"source","Doctype","Article.Title","Authors","Journal.Book","Year","search_string","DOI","URL","Title_cleaned"
"Google Scholar",NA,"Sweet lies: neural, visual, and behavioral measures reveal a lack of self-control conflict during food choice in weight-concerned women","LN van der Laan, DTD de Ridder…","LN van der Laan, DTD de Ridder… - Frontiers in behavioral …, 2014 - frontiersin.org","2014","socially desirable responding",NA,"https://www.frontiersin.org/articles/10.3389/fnbeh.2014.00184/full","sweetliesneuralvisualandbehavioralmeasuresrevealalackofselfcontrolconflictduringfoodchoiceinweightconcernedwomen"
"Google Scholar",NA,"Interaction between implicit aggression and dispositional self-control in explaining counterproductive work behaviors","Z Galić, M Ružojčić","Z Galić, M Ružojčić - Personality and individual differences, 2017 - Elsevier","2017","socially desirable responding",NA,"https://www.sciencedirect.com/science/article/pii/S0191886916308881","interactionbetweenimplicitaggressionanddispositionalselfcontrolinexplainingcounterproductiveworkbehaviors"
"Google Scholar",NA,"Predicting academic dishonesty on national examinations: The roles of gender, previous performance, examination center change, city change, and region change","GD Sideridis, I Tsaousis, K Al Harbi","GD Sideridis, I Tsaousis, K Al Harbi - Ethics & Behavior, 2016 - Taylor & Francis","2016","socially desirable responding",NA,"https://www.tandfonline.com/doi/abs/10.1080/10508422.2015.1009630","predictingacademicdishonestyonnationalexaminationstherolesofgenderpreviousperformanceexaminationcenterchangecitychangeandregionchange"
"Google Scholar",NA,"Facilitating self-regulated learning with technology: Evidence for student motivation and exam improvement","LK Barber, PG Bagsby, MJ Grawitch…","LK Barber, PG Bagsby, MJ Grawitch… - Teaching of …, 2011 - journals.sagepub.com","2011","socially desirable responding",NA,"https://journals.sagepub.com/doi/abs/10.1177/0098628311421337","facilitatingselfregulatedlearningwithtechnologyevidenceforstudentmotivationandexamimprovement"
"Google Scholar",NA,"Don't sweat the big stuff: emphasizing importance hinders goal pursuit for consumers low in dispositional self-control resources","SW Davis, KL Haws","SW Davis, KL Haws - Journal of the Association for …, 2017 - journals.uchicago.edu","2017","socially desirable responding",NA,"https://www.journals.uchicago.edu/doi/abs/10.1086/690115","dontsweatthebigstuffemphasizingimportancehindersgoalpursuitforconsumerslowindispositionalselfcontrolresources"
"Google Scholar",NA,"Development of indirect measures of conscientiousness: Combining a facets approach and network analysis","G Costantini, J Richetin, D Borsboom…","G Costantini, J Richetin, D Borsboom… - European Journal …, 2015 - journals.sagepub.com","2015","socially desirable responding",NA,"https://journals.sagepub.com/doi/abs/10.1002/per.2014","developmentofindirectmeasuresofconscientiousnesscombiningafacetsapproachandnetworkanalysis"
"Google Scholar",NA,"Me or us? Self-control promotes a healthy balance between personal and relationship concerns","ML Visserman, F Righetti…","ML Visserman, F Righetti… - Social …, 2017 - journals.sagepub.com","2017","socially desirable responding",NA,"https://journals.sagepub.com/doi/abs/10.1177/1948550616662121","meorusselfcontrolpromotesahealthybalancebetweenpersonalandrelationshipconcerns"
"Google Scholar",NA,"The Benefits and possible costs of Positive Core Self-Evaluations: A Review and Agenda for","TA Judge, C Hurst","TA Judge, C Hurst - Positive organizational behavior, 2007 - books.google.com","2007","socially desirable responding",NA,"https://books.google.com/books?hl=en&lr=&id=BHcEDx2TDfwC&oi=fnd&pg=PA159&dq=%22socially+desirable+responding%22&ots=6pOQUW_VHK&sig=Va8g-psdA0gH9ii1RE-wJC-uwp8","thebenefitsandpossiblecostsofpositivecoreselfevaluationsareviewandagendafor"
"Google Scholar",NA,"Personality and prosocial behavior: A theoretical framework and meta-analysis.","I Thielmann, G Spadaro, D Balliet","I Thielmann, G Spadaro, D Balliet - Psychological Bulletin, 2020 - psycnet.apa.org","2020","socially desirable responding",NA,"https://psycnet.apa.org/doiLanding?doi=10.1037/bul0000217","personalityandprosocialbehavioratheoreticalframeworkandmetaanalysis"
"Google Scholar",NA,"Self-control, injunctive norms, and descriptive norms predict engagement in plagiarism in a theory of planned behavior model","GJ Curtis, E Cowcher, BR Greene, K Rundle…","GJ Curtis, E Cowcher, BR Greene, K Rundle… - Journal of Academic …, 2018 - Springer","2018","socially desirable responding",NA,"https://link.springer.com/article/10.1007/s10805-018-9309-2","selfcontrolinjunctivenormsanddescriptivenormspredictengagementinplagiarisminatheoryofplannedbehaviormodel"
"Google Scholar",NA,"Further examination of the psychometric properties of the Brief Self-Control Scale: evidence from Chinese athletes and students","W Liang, DD Wang, BR Shang, CQ Zhang…","W Liang, DD Wang, BR Shang, CQ Zhang… - … Journal of Sport and …, 2020 - Taylor & Francis","2020","socially desirable responding",NA,"https://www.tandfonline.com/doi/abs/10.1080/1612197X.2020.1827000","furtherexaminationofthepsychometricpropertiesofthebriefselfcontrolscaleevidencefromchineseathletesandstudents"
"Google Scholar",NA,"Processes linking parents' and adolescents' religiousness and adolescent substance use: Monitoring and self-control","J Kim","J Kim-Spoon, JP Farley, C Holmes, GS Longo… - Journal of youth and …, 2014 - Springer","2014","socially desirable responding",NA,"https://link.springer.com/article/10.1007/s10964-013-9998-1","processeslinkingparentsandadolescentsreligiousnessandadolescentsubstanceusemonitoringandselfcontrol"
"Google Scholar",NA,"The association of self-regulation, habit, and mindfulness with texting while driving","MM Moore, PM Brown","MM Moore, PM Brown - Accident Analysis & Prevention, 2019 - Elsevier","2019","socially desirable responding",NA,"https://www.sciencedirect.com/science/article/pii/S0001457518308431","theassociationofselfregulationhabitandmindfulnesswithtextingwhiledriving"
"Google Scholar",NA,"Academic performance and student dropout. Results from two studies in upper secondary and higher education in Northern Norway","RG Sæle","RG Sæle - 2016 - munin.uit.no","2016","socially desirable responding",NA,"https://munin.uit.no/handle/10037/9507","academicperformanceandstudentdropoutresultsfromtwostudiesinuppersecondaryandhighereducationinnorthernnorway"
"Google Scholar",NA,"Culture and regulation: examining collectivism and individualism as predictors of self-control","MB Pyle","MB Pyle - 2011 - digitalcommons.georgiasouthern …","2011","socially desirable responding",NA,"https://digitalcommons.georgiasouthern.edu/etd/443/","cultureandregulationexaminingcollectivismandindividualismaspredictorsofselfcontrol"
"Google Scholar",NA,"Transcendent motivations and virtue development in adolescent marathon runners","SA Schnitker, MK Gilbertson, B Houltberg…","SA Schnitker, MK Gilbertson, B Houltberg… - Journal of …, 2020 - Wiley Online Library","2020","socially desirable responding",NA,"https://onlinelibrary.wiley.com/doi/abs/10.1111/jopy.12481","transcendentmotivationsandvirtuedevelopmentinadolescentmarathonrunners"
"Google Scholar",NA,"Assessment for Learning and Self-Regulation","JR Kirby, S Merchant","JR Kirby, S Merchant - Oxford Research Encyclopedia of Education, 2020 - oxfordre.com","2020","socially desirable responding",NA,"https://oxfordre.com/education/view/10.1093/acrefore/9780190264093.001.0001/acrefore-9780190264093-e-933","assessmentforlearningandselfregulation"
"Google Scholar",NA,"Recent research on free will: Conceptualizations, beliefs, and processes","RF Baumeister, AE Monroe","RF Baumeister, AE Monroe - Advances in experimental social psychology, 2014 - Elsevier","2014","socially desirable responding",NA,"https://www.sciencedirect.com/science/article/pii/B9780128002841000011","recentresearchonfreewillconceptualizationsbeliefsandprocesses"
"Google Scholar",NA,"Comparative analysis of attitudes and emotions among inmates: Does mental illness matter?","N Wolff, RD Morgan, J Shi","N Wolff, RD Morgan, J Shi - Criminal Justice and Behavior, 2013 - journals.sagepub.com","2013","socially desirable responding",NA,"https://journals.sagepub.com/doi/abs/10.1177/0093854813488760","comparativeanalysisofattitudesandemotionsamonginmatesdoesmentalillnessmatter"
"Google Scholar",NA,"Betydelsen av självkänsla och självkontroll för studenters stressupplevelse","L Olsson, S Jansson","L Olsson, S Jansson - 2013 - diva-portal.org","2013","socially desirable responding",NA,"https://www.diva-portal.org/smash/get/diva2:690883/FULLTEXT01.pdf","betydelsenavsjlvknslaochsjlvkontrollfrstudentersstressupplevelse"
"Google Scholar",NA,"The link between the brain volume derived index and the determinants of social performance","K Kokubun, Y Yamakawa, K Nemoto","K Kokubun, Y Yamakawa, K Nemoto - Current Psychology, 2022 - Springer","2022","socially desirable responding",NA,"https://link.springer.com/article/10.1007/s12144-021-02544-3","thelinkbetweenthebrainvolumederivedindexandthedeterminantsofsocialperformance"
"Google Scholar",NA,"The complex role of complexity: How service providers can mitigate negative effects of perceived service complexity when selling professional services","S Mikolon, A Kolberg, T Haumann…","S Mikolon, A Kolberg, T Haumann… - Journal of Service …, 2015 - journals.sagepub.com","2015","socially desirable responding",NA,"https://journals.sagepub.com/doi/abs/10.1177/1094670514568778","thecomplexroleofcomplexityhowserviceproviderscanmitigatenegativeeffectsofperceivedservicecomplexitywhensellingprofessionalservices"
"Google Scholar",NA,"Money is power: Monetary intelligence—love of money and temptation of materialism among Czech University students","S Lemrová, E Reiterová, R Fatěnová, K Lemr…","S Lemrová, E Reiterová, R Fatěnová, K Lemr… - Journal of Business …, 2014 - Springer","2014","socially desirable responding",NA,"https://link.springer.com/article/10.1007/s10551-013-1915-8","moneyispowermonetaryintelligenceloveofmoneyandtemptationofmaterialismamongczechuniversitystudents"
"Google Scholar",NA,"Exploring pathways to gambling: Proposing the integrated risk and protective factors model of gambling types","NL Hearn, JL Ireland, M Eslea, JE Fisk","NL Hearn, JL Ireland, M Eslea, JE Fisk - Journal of Gambling Studies, 2021 - Springer","2021","socially desirable responding",NA,"https://link.springer.com/article/10.1007/s10899-020-09929-2","exploringpathwaystogamblingproposingtheintegratedriskandprotectivefactorsmodelofgamblingtypes"
"Google Scholar",NA,"Enhancing the Validity of Rating-Based Tests","PJ Legree, AM Ness, RN Kilcullen, AJ Koch","PJ Legree, AM Ness, RN Kilcullen, AJ Koch - 2018 - apps.dtic.mil","2018","socially desirable responding",NA,"https://apps.dtic.mil/sti/citations/AD1067951","enhancingthevalidityofratingbasedtests"
"Google Scholar",NA,"Moralizing mental states: The role of trait self-control and control perceptions","A Weiss, M Forstmann, P Burgmer","A Weiss, M Forstmann, P Burgmer - Cognition, 2021 - Elsevier","2021","socially desirable responding",NA,"https://www.sciencedirect.com/science/article/pii/S0010027721000810","moralizingmentalstatestheroleoftraitselfcontrolandcontrolperceptions"
"Google Scholar",NA,"Measures of self-regulation prospectively predict psychological adjustment in college freshmen","BL Gillie","BL Gillie - 2012 - rave.ohiolink.edu","2012","socially desirable responding",NA,"https://rave.ohiolink.edu/etdc/view?acc_num=osu1342721594","measuresofselfregulationprospectivelypredictpsychologicaladjustmentincollegefreshmen"
"Google Scholar",NA,"Decomposing achievement test scores into measures of cognitive and noncognitive skills","L Borghans, T Schils","L Borghans, T Schils - Available at SSRN 3414156, 2018 - papers.ssrn.com",NA,"socially desirable responding",NA,"https://papers.ssrn.com/sol3/papers.cfm?abstract_id=3414156","decomposingachievementtestscoresintomeasuresofcognitiveandnoncognitiveskills"
"Google Scholar",NA,"The (In) Effectiveness of Self-Control Interventions","SW Davis","SW Davis - 2015 - oaktrust.library.tamu.edu","2015","socially desirable responding",NA,"https://oaktrust.library.tamu.edu/handle/1969.1/155608","theineffectivenessofselfcontrolinterventions"
"Google Scholar",NA,"The role of self-control in pro-environmental behaviour","A Oniga","A Oniga - 2019 - research-repository.st-andrews.ac …","2019","socially desirable responding",NA,"https://research-repository.st-andrews.ac.uk/handle/10023/19249","theroleofselfcontrolinproenvironmentalbehaviour"
"Google Scholar",NA,"Antecedents of Sexual Infidelity in Romantic Relationships. A Literature Review of the Latest Empirical Results, Prevailing Explanatory Models, and Proposal of …","J Hergert","J Hergert - Kultur-und Sozialwissen-schaften, 2016 - d-nb.info","2016","socially desirable responding",NA,"https://d-nb.info/111489026X/34#page=62","antecedentsofsexualinfidelityinromanticrelationshipsaliteraturereviewofthelatestempiricalresultsprevailingexplanatorymodelsandproposalof"
"Google Scholar",NA,"Regaining Inbox Control: Information and Communication Technology (Ict) Demands, Work Rumination, and Well-Being","X Hu","X Hu - 2021 - search.proquest.com","2021","socially desirable responding",NA,"https://search.proquest.com/openview/3f76c02de41d2c6e9010bcf43472214b/1?pq-origsite=gscholar&cbl=18750&diss=y","regaininginboxcontrolinformationandcommunicationtechnologyictdemandsworkruminationandwellbeing"
"Google Scholar",NA,"Self-regulation and gambling in college students","MMG Kofeldt","MMG Kofeldt - 2011 - search.proquest.com","2011","socially desirable responding",NA,"https://search.proquest.com/openview/8525d2b88a8e6f8a6ef657e8724be5e7/1?pq-origsite=gscholar&cbl=18750","selfregulationandgamblingincollegestudents"
"Google Scholar",NA,"Testing and extending predictions of the trans-contextual model for leisure-time physical activity in middle school students","J Polet","J Polet - JYU dissertations, 2022 - jyx.jyu.fi","2022","socially desirable responding",NA,"https://jyx.jyu.fi/handle/123456789/80084","testingandextendingpredictionsofthetranscontextualmodelforleisuretimephysicalactivityinmiddleschoolstudents"
"Google Scholar",NA,"The hubris and humility effect and the domain-masculine intelligence type: exploration of determinants of gender differences in self-estimation of ability","JS Storek","JS Storek - 2011 - discovery.ucl.ac.uk","2011","socially desirable responding",NA,"https://discovery.ucl.ac.uk/id/eprint/1331910/","thehubrisandhumilityeffectandthedomainmasculineintelligencetypeexplorationofdeterminantsofgenderdifferencesinselfestimationofability"
"Google Scholar",NA,"Continuity with Future Selves in Delinquent, Financial, and Health-Related Decision Making","L Quinten","L Quinten - 2020 - bonndoc.ulb.uni-bonn.de","2020","socially desirable responding",NA,"https://bonndoc.ulb.uni-bonn.de/xmlui/handle/20.500.11811/8612","continuitywithfutureselvesindelinquentfinancialandhealthrelateddecisionmaking"
"Google Scholar",NA,"Self-compassionate perspective in the face of social rejection: Effects on eating cognitions and behaviors","JB Beekman","JB Beekman - 2016 - search.proquest.com","2016","socially desirable responding",NA,"https://search.proquest.com/openview/ded0af583e98bbd028d8dc1df9f6fd74/1?pq-origsite=gscholar&cbl=18750","selfcompassionateperspectiveinthefaceofsocialrejectioneffectsoneatingcognitionsandbehaviors"
"Psycinfo_Measures","Journal Article","Patient-level moderators of the efficacy of peer support and pager reminder interventions to promote antiretroviral adherence.","Yard, Samantha S.; Huh, David; King, Kevin M.; Simoni, Jane M.","AIDS and Behavior","2011","marlowe-crown","10.1007/s10461-011-0001-4","http://proxy.lib.umich.edu/login?url=https://search.ebscohost.com/login.aspx?direct=true&db=psyh&AN=2011-23578-002&site=ehost-live&scope=site","patientlevelmoderatorsoftheefficacyofpeersupportandpagerreminderinterventionstopromoteantiretroviraladherence"
"Psycinfo_Measures","Journal Article","Competence over communion: Implicit evaluations of personality traits during goal pursuit.","Roczniewska, Marta; Kolanczyk, Alina","Polish Psychological Bulletin","2014","marlowe-crowne","10.2478/ppb-2014-0046","http://proxy.lib.umich.edu/login?url=https://search.ebscohost.com/login.aspx?direct=true&db=psyh&AN=2014-57297-004&site=ehost-live&scope=site","competenceovercommunionimplicitevaluationsofpersonalitytraitsduringgoalpursuit"
"Psycinfo_Measures","Journal Article","Construct validity and confirmatory factor analysis of the Self-Control and Self-Management Scale.","Mezo, Peter G.; Short, Megan M.","Canadian Journal of Behavioural Science / Revue canadienne des sciences du comportement","2012","marlowe-crowne","10.1037/a0024414","http://proxy.lib.umich.edu/login?url=https://search.ebscohost.com/login.aspx?direct=true&db=psyh&AN=2011-17128-001&site=ehost-live&scope=site","constructvalidityandconfirmatoryfactoranalysisoftheselfcontrolandselfmanagementscale"
"Psycinfo_Measures","Journal Article","Decision-making style mediates the relationship between trait self-control and self-reported criminal behavior.","McClanahan, William; van der Linden, Sander; Ruggeri, Kai","Personality and Individual Differences","2019","marlowe-crowne","10.1016/j.paid.2019.109537","http://proxy.lib.umich.edu/login?url=https://search.ebscohost.com/login.aspx?direct=true&db=psyh&AN=2019-56845-001&site=ehost-live&scope=site","decisionmakingstylemediatestherelationshipbetweentraitselfcontrolandselfreportedcriminalbehavior"
"Psycinfo_Measures","Journal Article","Effectiveness and implementation of evidence-based practices in residential care settings.","James, Sigrid; Alemi, Qais; Zepeda, Veronica","Children and Youth Services Review","2013","marlowe-crowne","10.1016/j.childyouth.2013.01.007","http://proxy.lib.umich.edu/login?url=https://search.ebscohost.com/login.aspx?direct=true&db=psyh&AN=2013-09134-009&site=ehost-live&scope=site","effectivenessandimplementationofevidencebasedpracticesinresidentialcaresettings"
"Psycinfo_Measures","Journal Article","Internet pornography use: Perceived addiction, psychological distress, and the validation of a brief measure.","Grubbs, Joshua B.; Volk, Fred; Exline, Julie J.; Pargament, Kenneth I.","Journal of Sex & Marital Therapy","2015","marlowe-crowne","10.1080/0092623X.2013.842192","http://proxy.lib.umich.edu/login?url=https://search.ebscohost.com/login.aspx?direct=true&db=psyh&AN=2014-49618-008&site=ehost-live&scope=site","internetpornographyuseperceivedaddictionpsychologicaldistressandthevalidationofabriefmeasure"
"Psycinfo_Measures","Journal Article","Psychological and social factors as predictors of online and offline deviant behavior among Japanese adolescents.","Udris, Reinis","Deviant Behavior","2017","marlowe-crowne","10.1080/01639625.2016.1197689","http://proxy.lib.umich.edu/login?url=https://search.ebscohost.com/login.aspx?direct=true&db=psyh&AN=2017-24693-006&site=ehost-live&scope=site","psychologicalandsocialfactorsaspredictorsofonlineandofflinedeviantbehavioramongjapaneseadolescents"
"Psycinfo_Measures","Journal Article","The Self-Control and Self-Management scale (SCMS): Development of an adaptive self-regulatory coping skills instrument.","Mezo, Peter G.","Journal of Psychopathology and Behavioral Assessment","2009","marlowe-crowne","10.1007/s10862-008-9104-2","http://proxy.lib.umich.edu/login?url=https://search.ebscohost.com/login.aspx?direct=true&db=psyh&AN=2009-04866-002&site=ehost-live&scope=site","theselfcontrolandselfmanagementscalescmsdevelopmentofanadaptiveselfregulatorycopingskillsinstrument"
"Psycinfo_Measures","Journal Article","Implicit versus explicit measures of self-concept of self-control and their differential predictive power for spontaneous trait-relevant behaviors.","Huntjens, Rafale J. C.; Rijkeboer, Marleen M.; Krakau, Andrej; de Jong, Peter J.","Journal of Behavior Therapy and Experimental Psychiatry","2014","social desirability","10.1016/j.jbtep.2013.07.001","http://proxy.lib.umich.edu/login?url=https://search.ebscohost.com/login.aspx?direct=true&db=psyh&AN=2013-42875-003&site=ehost-live&scope=site","implicitversusexplicitmeasuresofselfconceptofselfcontrolandtheirdifferentialpredictivepowerforspontaneoustraitrelevantbehaviors"
"Psycinfo_Measures","Journal Article","Passionate thinkers feel better: Self-control capacity as mediator of the relationship between need for cognition and affective adjustment.","Bertrams, Alex; Dickhuser, Oliver","Journal of Individual Differences","2012","social desirability","10.1027/1614-0001/a000081","http://proxy.lib.umich.edu/login?url=https://search.ebscohost.com/login.aspx?direct=true&db=psyh&AN=2012-03639-001&site=ehost-live&scope=site","passionatethinkersfeelbetterselfcontrolcapacityasmediatoroftherelationshipbetweenneedforcognitionandaffectiveadjustment"
"Psycinfo_Psyarticles_ERIC","Journal Article","Intergenerational transmission of self-regulation: A multidisciplinary review and integrative conceptual framework.","Bridgett, David J.; Burt, Nicole M.; Edwards, Erin S.; Deater-Deckard, Kirby","Psychological Bulletin","2015","impression management","10.1037/a0038662","http://proxy.lib.umich.edu/login?url=https://search.ebscohost.com/login.aspx?direct=true&db=pdh&AN=2015-18558-001&site=ehost-live&scope=site","intergenerationaltransmissionofselfregulationamultidisciplinaryreviewandintegrativeconceptualframework"
"Psycinfo_Psyarticles_ERIC","Journal Article","Convergence of direct, indirect, and objective risk-taking measures in gambling: The moderating role of impulsiveness and self-control.","Dislich, Friederike X. R.; Zinkernagel, Axel; Ortner, Tuulia M.; Schmitt, Manfred","Zeitschrift fr Psychologie/Journal of Psychology","2010","social desirability","10.1027/0044-3409/a000004","http://proxy.lib.umich.edu/login?url=https://search.ebscohost.com/login.aspx?direct=true&db=pdh&AN=2010-07223-004&site=ehost-live&scope=site","convergenceofdirectindirectandobjectiverisktakingmeasuresingamblingthemoderatingroleofimpulsivenessandselfcontrol"
"Psycinfo_Psyarticles_ERIC","Journal Article","Is parental mediation negatively associated with problematic media use among children and adolescents? A systematic review and meta-analysis.","Fam, Jia Yuin; Mnnikk, Niko; Juhari, Rumaya; Kriinen, Maria","Canadian Journal of Behavioural Science / Revue canadienne des sciences du comportement","2022","social desirability","10.1037/cbs0000320","http://proxy.lib.umich.edu/login?url=https://search.ebscohost.com/login.aspx?direct=true&db=pdh&AN=2022-36699-001&site=ehost-live&scope=site","isparentalmediationnegativelyassociatedwithproblematicmediauseamongchildrenandadolescentsasystematicreviewandmetaanalysis"
"ScienceDirect","Journal Article","The psychological immune response in the face of transgressions: Pseudo self-forgiveness and threat to belonging","Woodyatt L,Wenzel M","Journal of Experimental Social Psychology","2013","impression management","10.1016/j.jesp.2013.05.016","https://www.sciencedirect.com/science/article/pii/S0022103113001121;http://dx.doi.org/10.1016/j.jesp.2013.05.016","thepsychologicalimmuneresponseinthefaceoftransgressionspseudoselfforgivenessandthreattobelonging"
"ScienceDirect","Book Chapter","S","","","2019","impression management","10.1016/B978-0-12-813150-3.00019-X","https://www.sciencedirect.com/science/article/pii/B978012813150300019X;http://dx.doi.org/10.1016/B978-0-12-813150-3.00019-X","s"
"ScienceDirect","Book Chapter","Chapter 17 - Measures of Forgiveness: Self-Report, Physiological, Chemical, and Behavioral Indicators","Worthington EL,Lavelock C,vanOyen Witvliet C,Rye MS,Tsang JA,Toussaint L","","2015","impression management","10.1016/B978-0-12-386915-9.00017-6","https://www.sciencedirect.com/science/article/pii/B9780123869159000176;http://dx.doi.org/10.1016/B978-0-12-386915-9.00017-6","chaptermeasuresofforgivenessselfreportphysiologicalchemicalandbehavioralindicators"
"ScienceDirect","Journal Article","The information processing foundations of human capital resources: Leveraging insights from information processing approaches to intelligence","Fagan J,Ployhart RE","Human Resource Management Review","2015","social desirability","10.1016/j.hrmr.2014.09.003","https://www.sciencedirect.com/science/article/pii/S1053482214000485;http://dx.doi.org/10.1016/j.hrmr.2014.09.003","theinformationprocessingfoundationsofhumancapitalresourcesleveraginginsightsfrominformationprocessingapproachestointelligence"
"ScienceDirect","Journal Article","Using Temporal Self-Regulation Theory to understand healthy and unhealthy eating intentions and behaviour","Evans R,Norman P,Webb TL","Appetite","2017","social desirability","10.1016/j.appet.2017.05.022","https://www.sciencedirect.com/science/article/pii/S0195666316309072;http://dx.doi.org/10.1016/j.appet.2017.05.022","usingtemporalselfregulationtheorytounderstandhealthyandunhealthyeatingintentionsandbehaviour"
"ScienceDirect","Journal Article","Dangerous driving propensity amongst Indian youth","Assi GS","Transportation Research Part F: Traffic Psychology and Behaviour","2018","social desirability","10.1016/j.trf.2018.05.016","https://www.sciencedirect.com/science/article/pii/S1369847817301055;http://dx.doi.org/10.1016/j.trf.2018.05.016","dangerousdrivingpropensityamongstindianyouth"
"ScienceDirect","Journal Article","In the self-control and self-regulation maze: Integration and importance","Gro D","Personality and Individual Differences","2021","social desirability","10.1016/j.paid.2021.110728","https://www.sciencedirect.com/science/article/pii/S0191886921001033;http://dx.doi.org/10.1016/j.paid.2021.110728","intheselfcontrolandselfregulationmazeintegrationandimportance"
