position,title,result_id,publication_info,link,Authors,Year,google_scholar_url,page_number,keyword
0,Rethinking social desirability scales: From impression management to interpersonally oriented self-control,4zP45n2WwxMJ,"L Uziel - Perspectives on Psychological Science, 2010 - journals.sagepub.com",https://journals.sagepub.com/doi/abs/10.1177/1745691610369465,L Uziel,2010,"https://scholar.google.com/scholar?q=%22social+desirability%22&cites=6099775482241657013&hl=en&start=860&num=21&as_ylo=2004&as_yhi=2022&as_sdt=5,31&as_vis=1&scipsc=1",1,social desirability
1,Measuring Social Desirability Using a Novel Machine Learning Approach Based on EEG Data.,iFa2rkfddMgJ,"H Baumgartl, P Roessler, D Sauter, R Buettner - PACIS, 2020 - prof-buettner.de",http://www.prof-buettner.de/downloads/baumgartl2020e.pdf,"H Baumgartl, P Roessler, D Sauter, R Buettner",2020,"https://scholar.google.com/scholar?q=%22social+desirability%22&cites=6099775482241657013&hl=en&start=860&num=21&as_ylo=2004&as_yhi=2022&as_sdt=5,31&as_vis=1&scipsc=1",1,social desirability
2,Struggling to be liked: The prospective effect of trait self‐control on social desirability and the moderating role of agreeableness,QCcF1GGHZRkJ,"O Stavrova, MD Kokkoris - International Journal of Psychology, 2019 - Wiley Online Library",https://onlinelibrary.wiley.com/doi/abs/10.1002/ijop.12444,"O Stavrova, MD Kokkoris",2019,"https://scholar.google.com/scholar?q=%22social+desirability%22&cites=6099775482241657013&hl=en&start=860&num=21&as_ylo=2004&as_yhi=2022&as_sdt=5,31&as_vis=1&scipsc=1",1,social desirability
3,Are social desirability scales desirable? A meta‐analytic test of the validity of social desirability scales in the context of prosocial behavior,Z9AW3-sXWSoJ,"L Lanz, I Thielmann, FH Gerpott - Journal of personality, 2022 - Wiley Online Library",https://onlinelibrary.wiley.com/doi/abs/10.1111/jopy.12662,"L Lanz, I Thielmann, FH Gerpott",2022,"https://scholar.google.com/scholar?q=%22social+desirability%22&cites=6099775482241657013&hl=en&start=860&num=21&as_ylo=2004&as_yhi=2022&as_sdt=5,31&as_vis=1&scipsc=1",1,social desirability
4,Professionalism: self-control matters,av3lXubOLNcJ,"PJ Hershberger, TW Zryd, MB Rodes, A Stolfi - Medical teacher, 2010 - Taylor & Francis",https://www.tandfonline.com/doi/abs/10.3109/01421590903199676,"PJ Hershberger, TW Zryd, MB Rodes, A Stolfi",2010,"https://scholar.google.com/scholar?q=%22social+desirability%22&cites=6099775482241657013&hl=en&start=860&num=21&as_ylo=2004&as_yhi=2022&as_sdt=5,31&as_vis=1&scipsc=1",1,social desirability
5,NARCISSISM VERSUS MACHIAVELLIANISM AND THE ROLE OF SELF CONTROL TOWARDS SOCIAL DESIRABILITY.,IdsiXTtsao8J,"PB GALA, RS CHAUHAN, RA KING - Marketing Management …, 2020 - academia.edu",https://www.academia.edu/download/64794519/MMJ2.pdf,"PB GALA, RS CHAUHAN, RA KING",2020,"https://scholar.google.com/scholar?q=%22social+desirability%22&cites=6099775482241657013&hl=en&start=860&num=21&as_ylo=2004&as_yhi=2022&as_sdt=5,31&as_vis=1&scipsc=1",1,social desirability
6,The Balanced inventory of desirable responding (BIDR) a reliability generalization study,FCI7OyakZS8J,"A Li, J Bagger - Educational and psychological measurement, 2007 - journals.sagepub.com",https://journals.sagepub.com/doi/abs/10.1177/0013164406292087,"A Li, J Bagger",2007,"https://scholar.google.com/scholar?q=%22social+desirability%22&cites=6099775482241657013&hl=en&start=860&num=21&as_ylo=2004&as_yhi=2022&as_sdt=5,31&as_vis=1&scipsc=1",1,social desirability
7,Problem drinking and extradyadic sex in young adult romantic relationships,AVLWgxPr9HIJ,"SM Graham, S Negash, NM Lambert… - Journal of Social and …, 2016 - Guilford Press",https://guilfordjournals.com/doi/abs/10.1521/jscp.2016.35.2.152,"SM Graham, S Negash, NM Lambert…",2016,"https://scholar.google.com/scholar?q=%22social+desirability%22&cites=6099775482241657013&hl=en&start=860&num=21&as_ylo=2004&as_yhi=2022&as_sdt=5,31&as_vis=1&scipsc=1",1,social desirability
8,Low trait self‐control predicts self‐handicapping,4gGh3-SqJV8J,"A Uysal, CR Knee - Journal of Personality, 2012 - Wiley Online Library",https://onlinelibrary.wiley.com/doi/abs/10.1111/j.1467-6494.2011.00715.x,"A Uysal, CR Knee",2012,"https://scholar.google.com/scholar?q=%22social+desirability%22&cites=6099775482241657013&hl=en&start=860&num=21&as_ylo=2004&as_yhi=2022&as_sdt=5,31&as_vis=1&scipsc=1",1,social desirability
9,Passionate thinkers feel better,wjE3bPczEdAJ,"A Bertrams, O Dickhäuser - Journal of Individual Differences, 2012 - econtent.hogrefe.com",https://econtent.hogrefe.com/doi/full/10.1027/1614-0001/a000081,"A Bertrams, O Dickhäuser",2012,"https://scholar.google.com/scholar?q=%22social+desirability%22&cites=6099775482241657013&hl=en&start=860&num=21&as_ylo=2004&as_yhi=2022&as_sdt=5,31&as_vis=1&scipsc=1",1,social desirability
10,The Selfish Side of Self–Control,OqXq-zcHdtcJ,"L Uziel, URI Hefetz - European Journal of Personality, 2014 - journals.sagepub.com",https://journals.sagepub.com/doi/abs/10.1002/per.1972,"L Uziel, URI Hefetz",2014,"https://scholar.google.com/scholar?q=%22social+desirability%22&cites=6099775482241657013&hl=en&start=860&num=21&as_ylo=2004&as_yhi=2022&as_sdt=5,31&as_vis=1&scipsc=1",1,social desirability
11,Assessing jail inmates' proneness to shame and guilt: Feeling bad about the behavior or the self?,7de_-H7ai2UJ,"JP Tangney, J Stuewig, D Mashek… - Criminal justice and …, 2011 - journals.sagepub.com",https://journals.sagepub.com/doi/abs/10.1177/0093854811405762,"JP Tangney, J Stuewig, D Mashek…",2011,"https://scholar.google.com/scholar?q=%22social+desirability%22&cites=6099775482241657013&hl=en&start=860&num=21&as_ylo=2004&as_yhi=2022&as_sdt=5,31&as_vis=1&scipsc=1",1,social desirability
12,"Self-Control as a personal resource: determining its relationships to success, perseverance, and well-being",IhJrBD5vrh8J,"TO Gordeeva, EN Osin, DD Suchkov… - Russian Education & …, 2017 - Taylor & Francis",https://www.tandfonline.com/doi/abs/10.1080/10609393.2017.1408367,"TO Gordeeva, EN Osin, DD Suchkov…",2017,"https://scholar.google.com/scholar?q=%22social+desirability%22&cites=6099775482241657013&hl=en&start=860&num=21&as_ylo=2004&as_yhi=2022&as_sdt=5,31&as_vis=1&scipsc=1",1,social desirability
13,The relationship between self-control and health: The mediating effect of avoidant coping,AJP4QBtfQ6MJ,"A Boals, MR Vandellen, JB Banks - Psychology & health, 2011 - Taylor & Francis",https://www.tandfonline.com/doi/abs/10.1080/08870446.2010.529139,"A Boals, MR Vandellen, JB Banks",2011,"https://scholar.google.com/scholar?q=%22social+desirability%22&cites=6099775482241657013&hl=en&start=860&num=21&as_ylo=2004&as_yhi=2022&as_sdt=5,31&as_vis=1&scipsc=1",1,social desirability
14,"High-school students' need for cognition, self-control capacity, and school achievement: Testing a mediation hypothesis",4g9Pfb1hfQ8J,"A Bertrams, O Dickhäuser - Learning and Individual Differences, 2009 - Elsevier",https://www.sciencedirect.com/science/article/pii/S1041608008000575,"A Bertrams, O Dickhäuser",2009,"https://scholar.google.com/scholar?q=%22social+desirability%22&cites=6099775482241657013&hl=en&start=860&num=21&as_ylo=2004&as_yhi=2022&as_sdt=5,31&as_vis=1&scipsc=1",1,social desirability
15,Mother and father socially desirable responding in nine countries: Two kinds of agreement and relations to parenting self‐reports,hHKuvW37-PUJ,"MH Bornstein, DL Putnick, JE Lansford… - International Journal …, 2015 - Wiley Online Library",https://onlinelibrary.wiley.com/doi/abs/10.1002/ijop.12084,"MH Bornstein, DL Putnick, JE Lansford…",2015,"https://scholar.google.com/scholar?q=%22social+desirability%22&cites=6099775482241657013&hl=en&start=860&num=21&as_ylo=2004&as_yhi=2022&as_sdt=5,31&as_vis=1&scipsc=1",1,social desirability
16,Psychometric assessment of the short grit scale among Chinese adolescents,acVfVd4-L5wJ,"J Li, Y Zhao, F Kong, S Du, S Yang… - Journal of …, 2018 - journals.sagepub.com",https://journals.sagepub.com/doi/abs/10.1177/0734282916674858,"J Li, Y Zhao, F Kong, S Du, S Yang…",2018,"https://scholar.google.com/scholar?q=%22social+desirability%22&cites=6099775482241657013&hl=en&start=860&num=21&as_ylo=2004&as_yhi=2022&as_sdt=5,31&as_vis=1&scipsc=1",1,social desirability
17,Forgiving the self: Conceptual issues and empirical findings,hq9eBGVNUpYJ,"JP Tangney, AL Boone, R Dearing - Handbook of forgiveness, 2007 - taylorfrancis.com",https://www.taylorfrancis.com/chapters/edit/10.4324/9780203955673-17/forgiving-self-conceptual-issues-empirical-findings-june-price-tangney-angela-boone-ronda-dearing,"JP Tangney, AL Boone, R Dearing",2007,"https://scholar.google.com/scholar?q=%22social+desirability%22&cites=6099775482241657013&hl=en&start=860&num=21&as_ylo=2004&as_yhi=2022&as_sdt=5,31&as_vis=1&scipsc=1",1,social desirability
18,The development and validation of a measure of character: The CIVIC,C7z_DZvB2KoJ,"V Ng, L Tay, L Kuykendall - The Journal of Positive Psychology, 2018 - Taylor & Francis",https://www.tandfonline.com/doi/abs/10.1080/17439760.2017.1291850,"V Ng, L Tay, L Kuykendall",2018,"https://scholar.google.com/scholar?q=%22social+desirability%22&cites=6099775482241657013&hl=en&start=860&num=21&as_ylo=2004&as_yhi=2022&as_sdt=5,31&as_vis=1&scipsc=1",1,social desirability
19,Choosing goals that express the true self: A novel mechanism of the effect of self‐control on goal attainment,YHlOd0_-r2YJ,"O Stavrova, T Pronk… - European Journal of Social …, 2019 - Wiley Online Library",https://onlinelibrary.wiley.com/doi/abs/10.1002/ejsp.2559,"O Stavrova, T Pronk…",2019,"https://scholar.google.com/scholar?q=%22social+desirability%22&cites=6099775482241657013&hl=en&start=860&num=21&as_ylo=2004&as_yhi=2022&as_sdt=5,31&as_vis=1&scipsc=1",1,social desirability
0,It's all about control: The role of self-control in buffering the effects of negative reciprocity beliefs and trait anger on workplace deviance,zcPL0Yo_aPoJ,"SLD Restubog, PRJM Garcia, L Wang… - Journal of Research in …, 2010 - Elsevier",https://www.sciencedirect.com/science/article/pii/S0092656610000905,"SLD Restubog, PRJM Garcia, L Wang…",2010,"https://scholar.google.com/scholar?q=%22social+desirability%22&cites=6099775482241657013&hl=en&start=860&num=21&as_ylo=2004&as_yhi=2022&as_sdt=5,31&as_vis=1&scipsc=1",2,social desirability
1,Muslim experiential religiousness: Spirituality relationships with psychological and religious adjustment in Iran,-USoq7lRZuMJ,"N Ghorbani, PJ Watson, M Madani… - Journal of Spirituality in …, 2016 - Taylor & Francis",https://www.tandfonline.com/doi/abs/10.1080/19349637.2016.1162676,"N Ghorbani, PJ Watson, M Madani…",2016,"https://scholar.google.com/scholar?q=%22social+desirability%22&cites=6099775482241657013&hl=en&start=860&num=21&as_ylo=2004&as_yhi=2022&as_sdt=5,31&as_vis=1&scipsc=1",2,social desirability
2,"Impression management (“lie”) scales are associated with interpersonally oriented self‐control, not other‐deception",LSkQIQQD-dIJ,"L Uziel - Journal of personality, 2014 - Wiley Online Library",https://onlinelibrary.wiley.com/doi/abs/10.1111/jopy.12045,L Uziel,2014,"https://scholar.google.com/scholar?q=%22social+desirability%22&cites=6099775482241657013&hl=en&start=860&num=21&as_ylo=2004&as_yhi=2022&as_sdt=5,31&as_vis=1&scipsc=1",2,social desirability
3,"Characterizing the role of impulsivity in costly, reactive aggression using a novel paradigm",PBVzFtSItFEJ,"KL Meidenbauer, KW Choe, A Bakkour, M Inzlicht… - 2021 - psyarxiv.com",https://psyarxiv.com/kw3by/,"KL Meidenbauer, KW Choe, A Bakkour, M Inzlicht…",2021,"https://scholar.google.com/scholar?q=%22social+desirability%22&cites=6099775482241657013&hl=en&start=860&num=21&as_ylo=2004&as_yhi=2022&as_sdt=5,31&as_vis=1&scipsc=1",2,social desirability
4,The role of social worldviews and self-control in moral disengagement,0KKiDPq6euMJ,"V Alexandra - Personality and Individual Differences, 2019 - Elsevier",https://www.sciencedirect.com/science/article/pii/S0191886919300868,V Alexandra,2019,"https://scholar.google.com/scholar?q=%22social+desirability%22&cites=6099775482241657013&hl=en&start=860&num=21&as_ylo=2004&as_yhi=2022&as_sdt=5,31&as_vis=1&scipsc=1",2,social desirability
5,I want to keep on exercising but I don't: The negative impact of momentary lacks of self-control on exercise adherence,t1JhmygZeZoJ,"C Englert, J Rummel - Psychology of Sport and Exercise, 2016 - Elsevier",https://www.sciencedirect.com/science/article/pii/S1469029216300681,"C Englert, J Rummel",2016,"https://scholar.google.com/scholar?q=%22social+desirability%22&cites=6099775482241657013&hl=en&start=860&num=21&as_ylo=2004&as_yhi=2022&as_sdt=5,31&as_vis=1&scipsc=1",2,social desirability
6,"How are sociosexuality, sex drive, and lifetime number of sexual partners related?",jcC7NioqrzwJ,"JM Ostovich, J Sabini - Personality and Social Psychology …, 2004 - journals.sagepub.com",https://journals.sagepub.com/doi/abs/10.1177/0146167204264754,"JM Ostovich, J Sabini",2004,"https://scholar.google.com/scholar?q=%22social+desirability%22&cites=6099775482241657013&hl=en&start=860&num=21&as_ylo=2004&as_yhi=2022&as_sdt=5,31&as_vis=1&scipsc=1",2,social desirability
7,Impression management and achievement motivation: Investigating substantive links,uWTfaAO-c-oJ,"AJ Elliot, N Aldhobaiban, K Murayama… - International Journal …, 2018 - Wiley Online Library",https://onlinelibrary.wiley.com/doi/abs/10.1002/ijop.12252,"AJ Elliot, N Aldhobaiban, K Murayama…",2018,"https://scholar.google.com/scholar?q=%22social+desirability%22&cites=6099775482241657013&hl=en&start=860&num=21&as_ylo=2004&as_yhi=2022&as_sdt=5,31&as_vis=1&scipsc=1",2,social desirability
8,Normal and Abnormal Personality Patterns in a Pa-tient with Leukemia: A Clinical Case study,C4wPwitXjC0J,"H Kashanaki, F Dehghani-Arani, T Ferdousi - Journal of research in …, 2019 - sid.ir",https://www.sid.ir/FileServer/JF/45113970406,"H Kashanaki, F Dehghani",2019,"https://scholar.google.com/scholar?q=%22social+desirability%22&cites=6099775482241657013&hl=en&start=860&num=21&as_ylo=2004&as_yhi=2022&as_sdt=5,31&as_vis=1&scipsc=1",2,social desirability
9,The loss of control over eating scale: development and psychometric evaluation,ySnspGLX7_UJ,"JD Latner, JM Mond, MC Kelly… - … Journal of Eating …, 2014 - Wiley Online Library",https://onlinelibrary.wiley.com/doi/abs/10.1002/eat.22296,"JD Latner, JM Mond, MC Kelly…",2014,"https://scholar.google.com/scholar?q=%22social+desirability%22&cites=6099775482241657013&hl=en&start=860&num=21&as_ylo=2004&as_yhi=2022&as_sdt=5,31&as_vis=1&scipsc=1",2,social desirability
10,Inducing disbelief in free will alters brain correlates of preconscious motor preparation: The brain minds whether we believe in free will or not,YF7AX8sQLQwJ,"D Rigoni, S Kühn, G Sartori… - Psychological science, 2011 - journals.sagepub.com",https://journals.sagepub.com/doi/abs/10.1177/0956797611405680,"D Rigoni, S Kühn, G Sartori…",2011,"https://scholar.google.com/scholar?q=%22social+desirability%22&cites=6099775482241657013&hl=en&start=860&num=21&as_ylo=2004&as_yhi=2022&as_sdt=5,31&as_vis=1&scipsc=1",2,social desirability
11,Trait self‐control predicts performance on behavioral tests of self‐control,QGYIdGqLeEQJ,"BJ Schmeichel, A Zell - Journal of personality, 2007 - Wiley Online Library",https://onlinelibrary.wiley.com/doi/abs/10.1111/j.1467-6494.2007.00455.x,"BJ Schmeichel, A Zell",2007,"https://scholar.google.com/scholar?q=%22social+desirability%22&cites=6099775482241657013&hl=en&start=860&num=21&as_ylo=2004&as_yhi=2022&as_sdt=5,31&as_vis=1&scipsc=1",2,social desirability
12,"The brief self-control scale predicts jail inmates' recidivism, substance dependence, and post-release adjustment",o2Kj9wv4v3AJ,"ET Malouf, KE Schaefer, EA Witt… - Personality and …, 2014 - journals.sagepub.com",https://journals.sagepub.com/doi/abs/10.1177/0146167213511666,"ET Malouf, KE Schaefer, EA Witt…",2014,"https://scholar.google.com/scholar?q=%22social+desirability%22&cites=6099775482241657013&hl=en&start=860&num=21&as_ylo=2004&as_yhi=2022&as_sdt=5,31&as_vis=1&scipsc=1",2,social desirability
13,"Self-control as a personality resource: Assessment and associations with performance, persistence and well-being",q8CcWlEXzR0J,"TO Gordeeva, EN Osin, DD Suchkov… - Cultural-historical …, 2016 - psyjournals.ru",https://psyjournals.ru/en/kip/2016/n2/gordeeva.shtml,"TO Gordeeva, EN Osin, DD Suchkov…",2016,"https://scholar.google.com/scholar?q=%22social+desirability%22&cites=6099775482241657013&hl=en&start=860&num=21&as_ylo=2004&as_yhi=2022&as_sdt=5,31&as_vis=1&scipsc=1",2,social desirability
14,The psychological tradeoffs of self-control: A multi-method investigation,4BcVhgKlOj0J,"DL Zabelina, MD Robinson, CL Anicha - Personality and Individual …, 2007 - Elsevier",https://www.sciencedirect.com/science/article/pii/S0191886907000049,"DL Zabelina, MD Robinson, CL Anicha",2007,"https://scholar.google.com/scholar?q=%22social+desirability%22&cites=6099775482241657013&hl=en&start=860&num=21&as_ylo=2004&as_yhi=2022&as_sdt=5,31&as_vis=1&scipsc=1",2,social desirability
15,Validating the voodoo doll task as a proxy for aggressive parenting behavior.,Nk24lEWOt74J,"RJ McCarthy, JL Crouch, AR Basham… - Psychology of …, 2016 - psycnet.apa.org",https://psycnet.apa.org/buy/2014-49432-001,"RJ McCarthy, JL Crouch, AR Basham…",2016,"https://scholar.google.com/scholar?q=%22social+desirability%22&cites=6099775482241657013&hl=en&start=860&num=21&as_ylo=2004&as_yhi=2022&as_sdt=5,31&as_vis=1&scipsc=1",2,social desirability
16,Understanding the cognitive and genetic underpinnings of procrastination: Evidence for shared genetic influences with goal management and executive function …,n5De3etEYCUJ,"DE Gustavson, A Miyake, JK Hewitt… - Journal of Experimental …, 2015 - psycnet.apa.org",https://psycnet.apa.org/doiLanding?doi=10.1037/xge0000110,"DE Gustavson, A Miyake, JK Hewitt…",2015,"https://scholar.google.com/scholar?q=%22social+desirability%22&cites=6099775482241657013&hl=en&start=860&num=21&as_ylo=2004&as_yhi=2022&as_sdt=5,31&as_vis=1&scipsc=1",2,social desirability
17,Effect of peer influence on unauthorized music downloading and sharing: The moderating role of self-construal,h-Q_M_YeSnYJ,"Z Yang, J Wang, M Mourali - Journal of Business Research, 2015 - Elsevier",https://www.sciencedirect.com/science/article/pii/S014829631400294X,"Z Yang, J Wang, M Mourali",2015,"https://scholar.google.com/scholar?q=%22social+desirability%22&cites=6099775482241657013&hl=en&start=860&num=21&as_ylo=2004&as_yhi=2022&as_sdt=5,31&as_vis=1&scipsc=1",2,social desirability
18,Reducing self-control by weakening belief in free will,4CNSLlKCSwoJ,"D Rigoni, S Kühn, G Gaudino, G Sartori… - Consciousness and …, 2012 - Elsevier",https://www.sciencedirect.com/science/article/pii/S1053810012001171,"D Rigoni, S Kühn, G Gaudino, G Sartori…",2012,"https://scholar.google.com/scholar?q=%22social+desirability%22&cites=6099775482241657013&hl=en&start=860&num=21&as_ylo=2004&as_yhi=2022&as_sdt=5,31&as_vis=1&scipsc=1",2,social desirability
19,Evaluating the predictive validity of the global competencies inventory for determining global leadership outcomes,gDWGRK_chXgJ,ET Le - 2016 - search.proquest.com,https://search.proquest.com/openview/ab8cc8fddedb936a2bb3daa36b3df47a/1?pq-origsite=gscholar&cbl=18750,ET Le,2016,"https://scholar.google.com/scholar?q=%22social+desirability%22&cites=6099775482241657013&hl=en&start=860&num=21&as_ylo=2004&as_yhi=2022&as_sdt=5,31&as_vis=1&scipsc=1",2,social desirability
0,Perpetuation of sexual objectification: The role of resource depletion,S6qgkJIb9HsJ,"JM Tyler, RM Calogero… - British Journal of Social …, 2017 - Wiley Online Library",https://bpspsychub.onlinelibrary.wiley.com/doi/abs/10.1111/bjso.12157,"JM Tyler, RM Calogero…",2017,"https://scholar.google.com/scholar?q=%22social+desirability%22&cites=6099775482241657013&hl=en&start=860&num=21&as_ylo=2004&as_yhi=2022&as_sdt=5,31&as_vis=1&scipsc=1",3,social desirability
1,Multiple-goal management: An examination of simultaneous pursuit of a weight-loss goal with another goal,7LrmllEcKYIJ,"HC McKee, N Ntoumanis - Journal of health psychology, 2014 - journals.sagepub.com",https://journals.sagepub.com/doi/abs/10.1177/1359105313485484,"HC McKee, N Ntoumanis",2014,"https://scholar.google.com/scholar?q=%22social+desirability%22&cites=6099775482241657013&hl=en&start=860&num=21&as_ylo=2004&as_yhi=2022&as_sdt=5,31&as_vis=1&scipsc=1",3,social desirability
2,Explaining the relationship between religiousness and substance use: self-control matters.,LpPzuIUBdbgJ,"CN DeWall, RS Pond Jr, EC Carter… - Journal of personality …, 2014 - psycnet.apa.org",https://psycnet.apa.org/record/2014-30504-006,"CN DeWall, RS Pond Jr, EC Carter…",2014,"https://scholar.google.com/scholar?q=%22social+desirability%22&cites=6099775482241657013&hl=en&start=860&num=21&as_ylo=2004&as_yhi=2022&as_sdt=5,31&as_vis=1&scipsc=1",3,social desirability
3,Self-control relies on glucose as a limited energy source: willpower is more than a metaphor.,OpnizJfiC_UJ,"MT Gailliot, RF Baumeister, CN DeWall… - Journal of personality …, 2007 - psycnet.apa.org",https://psycnet.apa.org/record/2007-00654-010,"MT Gailliot, RF Baumeister, CN DeWall…",2007,"https://scholar.google.com/scholar?q=%22social+desirability%22&cites=6099775482241657013&hl=en&start=860&num=21&as_ylo=2004&as_yhi=2022&as_sdt=5,31&as_vis=1&scipsc=1",3,social desirability
4,Measuring Love Languages and Relationship Quality,zkXxV1r6vrgJ,"EA Surijah, IMF Anggara - … Conference on Psychology and Multiculturalism 2017 - neliti.com",https://www.neliti.com/publications/217672/measuring-love-languages-and-relationship-quality,"EA Surijah, IMF Anggara",2017,"https://scholar.google.com/scholar?q=%22social+desirability%22&cites=6099775482241657013&hl=en&start=860&num=21&as_ylo=2004&as_yhi=2022&as_sdt=5,31&as_vis=1&scipsc=1",3,social desirability
5,The effects of computer-based mindfulness training on Self-control and Mindfulness within Ambulatorily assessed network Systems across Health-related …,x7rbKz6qOKwJ,"Z Rowland, M Wenzel, T Kubiak - Trials, 2016 - trialsjournal.biomedcentral.com",https://trialsjournal.biomedcentral.com/articles/10.1186/s13063-016-1707-4,"Z Rowland, M Wenzel, T Kubiak",2016,"https://scholar.google.com/scholar?q=%22social+desirability%22&cites=6099775482241657013&hl=en&start=860&num=21&as_ylo=2004&as_yhi=2022&as_sdt=5,31&as_vis=1&scipsc=1",3,social desirability
6,Predicting pornography use over time: Does self-reported “addiction” matter?,gdFeaLWx0uUJ,"JB Grubbs, JA Wilt, JJ Exline, KI Pargament - Addictive Behaviors, 2018 - Elsevier",https://www.sciencedirect.com/science/article/pii/S0306460318300935,"JB Grubbs, JA Wilt, JJ Exline, KI Pargament",2018,"https://scholar.google.com/scholar?q=%22social+desirability%22&cites=6099775482241657013&hl=en&start=860&num=21&as_ylo=2004&as_yhi=2022&as_sdt=5,31&as_vis=1&scipsc=1",3,social desirability
7,Grit: perseverance and passion for long-term goals.,1hxF6YTt12QJ,"AL Duckworth, C Peterson, MD Matthews… - Journal of personality …, 2007 - psycnet.apa.org",https://psycnet.apa.org/doiLanding?doi=10.1037/0022-3514.92.6.1087,"AL Duckworth, C Peterson, MD Matthews…",2007,"https://scholar.google.com/scholar?q=%22social+desirability%22&cites=6099775482241657013&hl=en&start=860&num=21&as_ylo=2004&as_yhi=2022&as_sdt=5,31&as_vis=1&scipsc=1",3,social desirability
8,Тест самообладания: психометрические характеристики и перспективы применения,TTfRpOSHz6YJ,"АА Золотарева - Психологический журнал, 2018 - elibrary.ru",https://elibrary.ru/item.asp?id=32243936,АА Золотарева,2018,"https://scholar.google.com/scholar?q=%22social+desirability%22&cites=6099775482241657013&hl=en&start=860&num=21&as_ylo=2004&as_yhi=2022&as_sdt=5,31&as_vis=1&scipsc=1",3,social desirability
9,Measuring mental well-being in Norway: validation of the Warwick-Edinburgh Mental Well-being Scale (WEMWBS),2AzQkX8EQTUJ,"ORF Smith, DE Alves, M Knapstad, E Haug, LE Aarø - Bmc Psychiatry, 2017 - Springer",https://link.springer.com/article/10.1186/s12888-017-1343-x,"ORF Smith, DE Alves, M Knapstad, E Haug, LE Aarø",2017,"https://scholar.google.com/scholar?q=%22social+desirability%22&cites=6099775482241657013&hl=en&start=860&num=21&as_ylo=2004&as_yhi=2022&as_sdt=5,31&as_vis=1&scipsc=1",3,social desirability
10,Transgression as addiction: Religiosity and moral disapproval as predictors of perceived addiction to pornography,rfUInbBwUMgJ,"JB Grubbs, JJ Exline, KI Pargament, JN Hook… - Archives of Sexual …, 2015 - Springer",https://link.springer.com/article/10.1007/s10508-013-0257-z,"JB Grubbs, JJ Exline, KI Pargament, JN Hook…",2015,"https://scholar.google.com/scholar?q=%22social+desirability%22&cites=6099775482241657013&hl=en&start=860&num=21&as_ylo=2004&as_yhi=2022&as_sdt=5,31&as_vis=1&scipsc=1",3,social desirability
11,"Young adults' perceptions of parental differential treatment: measurement and relations to psychological adjustment, attachment style, and close relationships.",eBMblBznGHkJ,LC Young - 2011 - dspace.library.uvic.ca,https://dspace.library.uvic.ca/handle/1828/3529,LC Young,2011,"https://scholar.google.com/scholar?q=%22social+desirability%22&cites=6099775482241657013&hl=en&start=860&num=21&as_ylo=2004&as_yhi=2022&as_sdt=5,31&as_vis=1&scipsc=1",3,social desirability
12,Positive disposition in the prediction of strategic independence among millennials,SDJhRDByLucJ,"R Konopaske, EG Kirby, SL Kirby - Administrative Sciences, 2017 - mdpi.com",https://www.mdpi.com/239108,"R Konopaske, EG Kirby, SL Kirby",2017,"https://scholar.google.com/scholar?q=%22social+desirability%22&cites=6099775482241657013&hl=en&start=860&num=21&as_ylo=2004&as_yhi=2022&as_sdt=5,31&as_vis=1&scipsc=1",3,social desirability
