position,title,result_id,publication_info,link,Authors,Year,google_scholar_url,page_number,keyword
12,What brings you pleasure? The role of desire within the development of compulsive purchasing,deMvr5_YocQJ,JM Rapp - 2012 - search.proquest.com,https://search.proquest.com/openview/42175682288a4eeddc8a0c9195eb83d5/1?pq-origsite=gscholar&cbl=18750,JM Rapp,2012,"https://scholar.google.com/scholar?q=%22social+desirability%22&cites=6099775482241657013&hl=en&start=860&num=21&as_ylo=2004&as_yhi=2022&as_sdt=5,31&as_vis=1&scipsc=1",32,social desirability
13,Black Box Analytics and Ethical Decision Making,lzWCE_V-7iAJ,"MJ Davern, PME Gondowijoyo… - Pamela R., Black Box …, 2019 - papers.ssrn.com",https://papers.ssrn.com/sol3/papers.cfm?abstract_id=3318717,"MJ Davern, PME Gondowijoyo…",2019,"https://scholar.google.com/scholar?q=%22social+desirability%22&cites=6099775482241657013&hl=en&start=860&num=21&as_ylo=2004&as_yhi=2022&as_sdt=5,31&as_vis=1&scipsc=1",32,social desirability
14,Compulsive buying among young adults: a behavioural segmentation,J342mhUjDKoJ,"A Maccarrone-Eaglen, P Schofield - Young Consumers, 2020 - emerald.com",https://www.emerald.com/insight/content/doi/10.1108/YC-02-2019-0958/full/html?skipTracking=true&utm_source=TrendMD&utm_medium=cpc&utm_campaign=Young_Consumers_TrendMD_1&WT.mc_id=Emerald_TrendMD_1,A Maccarrone,2020,"https://scholar.google.com/scholar?q=%22social+desirability%22&cites=6099775482241657013&hl=en&start=860&num=21&as_ylo=2004&as_yhi=2022&as_sdt=5,31&as_vis=1&scipsc=1",32,social desirability
15,The Effects of Ego Threat and Self-Esteem Boost on Overall Self-Control Ability,m5bXIBc8K3kJ,J Williamson - 2011 - search.proquest.com,https://search.proquest.com/openview/370e1556bf5fbf9e46c402173470b998/1?pq-origsite=gscholar&cbl=18750,J Williamson,2011,"https://scholar.google.com/scholar?q=%22social+desirability%22&cites=6099775482241657013&hl=en&start=860&num=21&as_ylo=2004&as_yhi=2022&as_sdt=5,31&as_vis=1&scipsc=1",32,social desirability
16,Inhibitory and Initiatory Self-Control at Work.,XF1yvbnDlZ4J,L Kreemers - innovatiefinwerk.nl,https://www.innovatiefinwerk.nl/sites/innovatiefinwerk.nl/files/field/bijlage/mastertheseloeskreemers_aangepast.pdf,L Kreemers,,"https://scholar.google.com/scholar?q=%22social+desirability%22&cites=6099775482241657013&hl=en&start=860&num=21&as_ylo=2004&as_yhi=2022&as_sdt=5,31&as_vis=1&scipsc=1",32,social desirability
17,Is consistently unfair better than sporadically fair? An investigation of justice variability and stress,WmEOCVzA0aYJ,"FK Matta, BA Scott, JA Colquitt… - Academy of …, 2017 - journals.aom.org",https://journals.aom.org/doi/abs/10.5465/amj.2014.0455,"FK Matta, BA Scott, JA Colquitt…",2017,"https://scholar.google.com/scholar?q=%22social+desirability%22&cites=6099775482241657013&hl=en&start=860&num=21&as_ylo=2004&as_yhi=2022&as_sdt=5,31&as_vis=1&scipsc=1",32,social desirability
18,The Role of Self-control in regard to the Association between Binge-watching and Sleep over Time: An Experience Sampling Study,NHTrO38wYToJ,L Schwerdtner - 2021 - essay.utwente.nl,http://essay.utwente.nl/86547/,L Schwerdtner,2021,"https://scholar.google.com/scholar?q=%22social+desirability%22&cites=6099775482241657013&hl=en&start=860&num=21&as_ylo=2004&as_yhi=2022&as_sdt=5,31&as_vis=1&scipsc=1",32,social desirability
19,Nudging The Food Basket Green: The Effects Of Commitment And Badges On The Carbon Footprint Of Food Shopping,UHEXZI7yCFoJ,"L Panzone, N Aucha, DJ Zizzoc - European Conference on Sensory and …, 2020 - uq.edu.au",http://www.uq.edu.au/economics/abstract/652.pdf,"L Panzone, N Aucha, DJ Zizzoc",2020,"https://scholar.google.com/scholar?q=%22social+desirability%22&cites=6099775482241657013&hl=en&start=860&num=21&as_ylo=2004&as_yhi=2022&as_sdt=5,31&as_vis=1&scipsc=1",32,social desirability
0,Mental contrasting spurs energy by changing implicit evaluations of obstacles.,5uAR2se5__IJ,"S Wittleder, A Kappes, NR Krott, M Jay… - Motivation …, 2020 - psycnet.apa.org",https://psycnet.apa.org/doiLanding?doi=10.1037/mot0000140,"S Wittleder, A Kappes, NR Krott, M Jay…",2020,"https://scholar.google.com/scholar?q=%22social+desirability%22&cites=6099775482241657013&hl=en&start=860&num=21&as_ylo=2004&as_yhi=2022&as_sdt=5,31&as_vis=1&scipsc=1",33,social desirability
1,Faith and Behavior,o9IzXRLZN8UJ,"C Miller-Perrin, E Krumrei Mancuso - Faith from a Positive Psychology …, 2015 - Springer",https://link.springer.com/chapter/10.1007/978-94-017-9436-7_3,C Miller,2015,"https://scholar.google.com/scholar?q=%22social+desirability%22&cites=6099775482241657013&hl=en&start=860&num=21&as_ylo=2004&as_yhi=2022&as_sdt=5,31&as_vis=1&scipsc=1",33,social desirability
2,Percepción de control en mujeres víctimas de la violencia de género: una clave para el empoderamiento,XvFly8aHcocJ,"VG Carrillo, II Castillo, RS Gruber - El empoderamiento de las mujeres como … - torrossa.com",https://www.torrossa.com/gs/resourceProxy?an=2978230&publisher=FZW453#page=429,"VG Carrillo, II Castillo, RS Gruber",,"https://scholar.google.com/scholar?q=%22social+desirability%22&cites=6099775482241657013&hl=en&start=860&num=21&as_ylo=2004&as_yhi=2022&as_sdt=5,31&as_vis=1&scipsc=1",33,social desirability
3,Mental health dynamics of interfaith spirituality in believers and non-believers: The two circuit pathways model of coping with adversities: Interfaith Spirituality …,FryegO0iENUJ,"I Kira, NA Özcan, H Shuwiekh, J Kucharska… - Psychology, 2021 - scirp.org",https://www.scirp.org/journal/paperinformation.aspx?paperid=110305,"I Kira, NA Özcan, H Shuwiekh, J Kucharska…",2021,"https://scholar.google.com/scholar?q=%22social+desirability%22&cites=6099775482241657013&hl=en&start=860&num=21&as_ylo=2004&as_yhi=2022&as_sdt=5,31&as_vis=1&scipsc=1",33,social desirability
4,Choosing not to buy when tempted: Advancing sustainable development with consumer moral restraint,wR-svps94NIJ,"LE Sekerka, P Kipfelsberger, D Stimel… - WORLD SCIENTIFIC …, 2022 - World Scientific",https://www.worldscientific.com/doi/abs/10.1142/9789811248870_0007,"LE Sekerka, P Kipfelsberger, D Stimel…",2022,"https://scholar.google.com/scholar?q=%22social+desirability%22&cites=6099775482241657013&hl=en&start=860&num=21&as_ylo=2004&as_yhi=2022&as_sdt=5,31&as_vis=1&scipsc=1",33,social desirability
5,Comparing the career transitions of younger and older adults: Contributions of adult attachment orientation and career adaptability to subjective well-being,k-YX6EGxQMIJ,K Ramos - 2015 - uh-ir.tdl.org,https://uh-ir.tdl.org/handle/10657/1928,K Ramos,2015,"https://scholar.google.com/scholar?q=%22social+desirability%22&cites=6099775482241657013&hl=en&start=860&num=21&as_ylo=2004&as_yhi=2022&as_sdt=5,31&as_vis=1&scipsc=1",33,social desirability
6,Model Kepribadian Conscientiousness terhadap Perilaku Akademik Kontraproduktif dengan Pengendalian Diri Sebagai Pemediasi,hHt6Sx7buxAJ,"ZM Rusdi - E-Mabis: Jurnal Ekonomi Manajemen dan Bisnis, 2017 - journal.unimal.ac.id",https://www.journal.unimal.ac.id/emabis/article/view/288,ZM Rusdi,2017,"https://scholar.google.com/scholar?q=%22social+desirability%22&cites=6099775482241657013&hl=en&start=860&num=21&as_ylo=2004&as_yhi=2022&as_sdt=5,31&as_vis=1&scipsc=1",33,social desirability
7,"Word Count: 7,801",Qi8okU70lc8J,"TJ Valshtein, PM Gollwitzer, G Oettingen, TJ Valshtein… - psyarxiv.com",https://psyarxiv.com/8p3sz/download,"TJ Valshtein, PM Gollwitzer, G Oettingen, TJ Valshtein…",,"https://scholar.google.com/scholar?q=%22social+desirability%22&cites=6099775482241657013&hl=en&start=860&num=21&as_ylo=2004&as_yhi=2022&as_sdt=5,31&as_vis=1&scipsc=1",33,social desirability
8,How to Raise Users' Awareness of Online Privacy: An Empirical and Theoretical Approach for Examining the Impact of Persuasive Privacy Support Measures on …,HnoYp5m3WKsJ,J Schäwel - 2019 - duepublico2.uni-due.de,https://duepublico2.uni-due.de/servlets/MCRFileNodeServlet/duepublico_derivate_00070696/Diss_Schaewel.pdf,J Schäwel,,"https://scholar.google.com/scholar?q=%22social+desirability%22&cites=6099775482241657013&hl=en&start=860&num=21&as_ylo=2004&as_yhi=2022&as_sdt=5,31&as_vis=1&scipsc=1",33,social desirability
9,A review of self-control's dark side,0oi84rfrAJ8J,"J Li, Y Nie, K Dou - Adv Psychol, 2018 - pdf.hanspub.org",https://pdf.hanspub.org/AP20181200000_76289053.pdf,"J Li, Y Nie, K Dou",2018,"https://scholar.google.com/scholar?q=%22social+desirability%22&cites=6099775482241657013&hl=en&start=860&num=21&as_ylo=2004&as_yhi=2022&as_sdt=5,31&as_vis=1&scipsc=1",33,social desirability
10,The costs of over-control in anorexia nervosa: evidence from fMRI and ecological momentary assessment,XUC3NXNs7ZoJ,"S Pauligk, M Seidel, S Fürtjes, JA King… - Translational …, 2021 - nature.com",https://www.nature.com/articles/s41398-021-01405-8,"S Pauligk, M Seidel, S Fürtjes, JA King…",2021,"https://scholar.google.com/scholar?q=%22social+desirability%22&cites=6099775482241657013&hl=en&start=860&num=21&as_ylo=2004&as_yhi=2022&as_sdt=5,31&as_vis=1&scipsc=1",33,social desirability
11,Too tempting to resist? Self-control moderates the relationship between narcissism and antisocial tendencies,n2cBb5Gs6Q8J,"R Fatfouta, R Rogoza, PP Brud, K Rentzsch - Journal of Research in …, 2022 - Elsevier",https://www.sciencedirect.com/science/article/pii/S0092656621000933,"R Fatfouta, R Rogoza, PP Brud, K Rentzsch",2022,"https://scholar.google.com/scholar?q=%22social+desirability%22&cites=6099775482241657013&hl=en&start=860&num=21&as_ylo=2004&as_yhi=2022&as_sdt=5,31&as_vis=1&scipsc=1",33,social desirability
12,Разработка пилотажной версии Теста самообладания,fe4cWNzYYugJ,"АА Золотарева - Психология. Историко-критические обзоры и …, 2016 - publishing-vak.ru",http://publishing-vak.ru/file/archive-psycology-2016-1/3-zolotareva.pdf,АА Золотарева,2016,"https://scholar.google.com/scholar?q=%22social+desirability%22&cites=6099775482241657013&hl=en&start=860&num=21&as_ylo=2004&as_yhi=2022&as_sdt=5,31&as_vis=1&scipsc=1",33,social desirability
13,Differentielle Psychologie-Persönlichkeitsforschung,wU4vCePERv0J,"H Weber, T Rammsayer - 2011 - books.google.com",https://books.google.com/books?hl=en&lr=&id=v9HSzamG0M8C&oi=fnd&pg=PA5&dq=%22social+desirability%22&ots=oA23cdTVjz&sig=Ak1HNii3Ue8LJ1q5aBK1U6C-6fg,"H Weber, T Rammsayer",2011,"https://scholar.google.com/scholar?q=%22social+desirability%22&cites=6099775482241657013&hl=en&start=860&num=21&as_ylo=2004&as_yhi=2022&as_sdt=5,31&as_vis=1&scipsc=1",33,social desirability
14,Investigating Medication Adherence: A Mixed Methods Study,J9C_Vd7a4NIJ,CR Liddelow - 2021 - espace.curtin.edu.au,https://espace.curtin.edu.au/handle/20.500.11937/84909,CR Liddelow,2021,"https://scholar.google.com/scholar?q=%22social+desirability%22&cites=6099775482241657013&hl=en&start=860&num=21&as_ylo=2004&as_yhi=2022&as_sdt=5,31&as_vis=1&scipsc=1",33,social desirability
15,"Academic engagement, motivation, self-regulation, and achievement of Georgia southern university sophomore students",vnKbBuTTOx4J,JO LeMay IV - 2017 - digitalcommons.georgiasouthern …,https://digitalcommons.georgiasouthern.edu/etd/1666/,JO LeMay IV,2017,"https://scholar.google.com/scholar?q=%22social+desirability%22&cites=6099775482241657013&hl=en&start=860&num=21&as_ylo=2004&as_yhi=2022&as_sdt=5,31&as_vis=1&scipsc=1",33,social desirability
16,"The Relationship between Substance Use Problems, Family Communication, Forgiveness, and Male Childhood Sexual Abuse",USaOSO4ac8QJ,RE Branscome - 2018 - search.proquest.com,https://search.proquest.com/openview/a17e797c0b7caf198e72b9f434a49402/1?pq-origsite=gscholar&cbl=18750,RE Branscome,2018,"https://scholar.google.com/scholar?q=%22social+desirability%22&cites=6099775482241657013&hl=en&start=860&num=21&as_ylo=2004&as_yhi=2022&as_sdt=5,31&as_vis=1&scipsc=1",33,social desirability
17,Control Yourself!: how are Trait and State Self-Control related to Prosociality in Young Adults?,osDAz6LEbHwJ,S Bagala - 2021 - essay.utwente.nl,http://essay.utwente.nl/87390/,S Bagala,2021,"https://scholar.google.com/scholar?q=%22social+desirability%22&cites=6099775482241657013&hl=en&start=860&num=21&as_ylo=2004&as_yhi=2022&as_sdt=5,31&as_vis=1&scipsc=1",33,social desirability
18,"An Evaluation of the Social Emotional Health Survey-Secondary for Use with Students with Learning Disabilities: Confirmatory Factor Analysis, Measurement …",gHEdx6epd7oJ,KW Carnazzo - 2017 - search.proquest.com,https://search.proquest.com/openview/7c1922d79101772662fc1b697bc8d143/1?pq-origsite=gscholar&cbl=18750,KW Carnazzo,2017,"https://scholar.google.com/scholar?q=%22social+desirability%22&cites=6099775482241657013&hl=en&start=860&num=21&as_ylo=2004&as_yhi=2022&as_sdt=5,31&as_vis=1&scipsc=1",33,social desirability
19,Mental Contrasting Modulates Automatic Attitudes Towards Obstacles of Reality,aqlt_nXURFQJ,S Wittleder - 2017 - ediss2.sub.uni-hamburg.de,https://ediss2.sub.uni-hamburg.de/handle/ediss/7086,S Wittleder,,"https://scholar.google.com/scholar?q=%22social+desirability%22&cites=6099775482241657013&hl=en&start=860&num=21&as_ylo=2004&as_yhi=2022&as_sdt=5,31&as_vis=1&scipsc=1",33,social desirability
0,Self-regarding disposition as a fraud risk-factor and its relationship with narcissism,9geDAKmL3BsJ,"V Raval, V Raval - ijbas.com",https://ijbas.com/wp-content/uploads/2021/06/Raval-Raval-2020-93.pdf,"V Raval, V Raval",,"https://scholar.google.com/scholar?q=%22social+desirability%22&cites=6099775482241657013&hl=en&start=860&num=21&as_ylo=2004&as_yhi=2022&as_sdt=5,31&as_vis=1&scipsc=1",34,social desirability
1,Either you control social media or social media controls you: understanding the impact of self‐control on excessive social media use from the dual‐system perspective,oc_0yj5eRlYJ,"K Zahrai, E Veer, PW Ballantine… - Journal of Consumer …, 2022 - Wiley Online Library",https://onlinelibrary.wiley.com/doi/abs/10.1111/joca.12449,"K Zahrai, E Veer, PW Ballantine…",2022,"https://scholar.google.com/scholar?q=%22social+desirability%22&cites=6099775482241657013&hl=en&start=860&num=21&as_ylo=2004&as_yhi=2022&as_sdt=5,31&as_vis=1&scipsc=1",34,social desirability
2,自我控制的阴暗面,iObNE-FYSrEJ,"李菁菁， 聂衍刚， 窦凯 - Advances in Psychology, 2018 - hanspub.org",https://www.hanspub.org/journal/PaperInformation.aspx?paperID=28131,李菁菁， 聂衍刚， 窦凯,2018,"https://scholar.google.com/scholar?q=%22social+desirability%22&cites=6099775482241657013&hl=en&start=860&num=21&as_ylo=2004&as_yhi=2022&as_sdt=5,31&as_vis=1&scipsc=1",34,social desirability
3,Effect of social identity salience on healthy eating intentions and behaviour,ZhXs9AdgHI0J,KJ Banas - 2015 - era.ed.ac.uk,https://era.ed.ac.uk/handle/1842/15891,KJ Banas,2015,"https://scholar.google.com/scholar?q=%22social+desirability%22&cites=6099775482241657013&hl=en&start=860&num=21&as_ylo=2004&as_yhi=2022&as_sdt=5,31&as_vis=1&scipsc=1",34,social desirability
4,Serving you depletes me? A leader-centric examination of servant leadership behaviors,UhHhkcY_ZjEJ,"C Liao, HW Lee, RE Johnson… - Journal of …, 2021 - journals.sagepub.com",https://journals.sagepub.com/doi/abs/10.1177/0149206320906883,"C Liao, HW Lee, RE Johnson…",2021,"https://scholar.google.com/scholar?q=%22social+desirability%22&cites=6099775482241657013&hl=en&start=860&num=21&as_ylo=2004&as_yhi=2022&as_sdt=5,31&as_vis=1&scipsc=1",34,social desirability
5,"Three measures of coping in video games (CIV-III): the development, construct validation, and profile analysis of the CIV-III",GreByS0cXIAJ,CM Hughes - 2018 - search.proquest.com,https://search.proquest.com/openview/f697504940ee0de52d829c3af1ec21b1/1?pq-origsite=gscholar&cbl=18750,CM Hughes,2018,"https://scholar.google.com/scholar?q=%22social+desirability%22&cites=6099775482241657013&hl=en&start=860&num=21&as_ylo=2004&as_yhi=2022&as_sdt=5,31&as_vis=1&scipsc=1",34,social desirability
6,"Grit, Success, and Retention Among Boxers in the National Collegiate Boxing Association",8aiSLv_iE7YJ,IA Varisano - 2021 - search.proquest.com,https://search.proquest.com/openview/7b02ed320ed536b0e469b7c522281dd3/1?pq-origsite=gscholar&cbl=18750&diss=y,IA Varisano,2021,"https://scholar.google.com/scholar?q=%22social+desirability%22&cites=6099775482241657013&hl=en&start=860&num=21&as_ylo=2004&as_yhi=2022&as_sdt=5,31&as_vis=1&scipsc=1",34,social desirability
7,Variation of learning intensity in late adolescence and the impact on noncognitive skills,hQHQ4N7o1uYJ,"B Büttner, H Thiel, SL Thomsen - ZEW-Centre for European …, 2011 - papers.ssrn.com",https://papers.ssrn.com/sol3/papers.cfm?abstract_id=1759409,"B Büttner, H Thiel, SL Thomsen",2011,"https://scholar.google.com/scholar?q=%22social+desirability%22&cites=6099775482241657013&hl=en&start=860&num=21&as_ylo=2004&as_yhi=2022&as_sdt=5,31&as_vis=1&scipsc=1",34,social desirability
8,Patience as a development virtue and common therapeutic factor,c_r8BGFi8P4J,"VE Worthen Ph D - Issues in Religion and Psychotherapy, 2018 - scholarsarchive.byu.edu",https://scholarsarchive.byu.edu/irp/vol39/iss1/9/,VE Worthen Ph D,2018,"https://scholar.google.com/scholar?q=%22social+desirability%22&cites=6099775482241657013&hl=en&start=860&num=21&as_ylo=2004&as_yhi=2022&as_sdt=5,31&as_vis=1&scipsc=1",34,social desirability
9,The Effect of Exercise on Emotion Regulation,Bn4tpFqc-XsJ,S Sylvetsky - 2015 - digitalworks.union.edu,https://digitalworks.union.edu/theses/396/,S Sylvetsky,2015,"https://scholar.google.com/scholar?q=%22social+desirability%22&cites=6099775482241657013&hl=en&start=860&num=21&as_ylo=2004&as_yhi=2022&as_sdt=5,31&as_vis=1&scipsc=1",34,social desirability
10,"Noncognitive skills in economics: Models, measurement, and empirical evidence",LsEsyEg3UWcJ,"H Thiel, SL Thomsen - Research in Economics, 2013 - Elsevier",https://www.sciencedirect.com/science/article/pii/S1090944313000136,"H Thiel, SL Thomsen",2013,"https://scholar.google.com/scholar?q=%22social+desirability%22&cites=6099775482241657013&hl=en&start=860&num=21&as_ylo=2004&as_yhi=2022&as_sdt=5,31&as_vis=1&scipsc=1",34,social desirability
11,Lose your self-control to video game violence: The dual impact of ego depletion and violent video game play on aggression,RvGRcx_IJYIJ,WY Tang - 2012 - rave.ohiolink.edu,https://rave.ohiolink.edu/etdc/view?acc_num=osu1338307763,WY Tang,2012,"https://scholar.google.com/scholar?q=%22social+desirability%22&cites=6099775482241657013&hl=en&start=860&num=21&as_ylo=2004&as_yhi=2022&as_sdt=5,31&as_vis=1&scipsc=1",34,social desirability
12,Goal Orientation and Alcohol Use During the Transition to College,Hftwoip17toJ,AM Grant - 2021 - search.proquest.com,https://search.proquest.com/openview/2a5f8e87f4911a4afccb4449198a33e3/1?pq-origsite=gscholar&cbl=18750&diss=y,AM Grant,2021,"https://scholar.google.com/scholar?q=%22social+desirability%22&cites=6099775482241657013&hl=en&start=860&num=21&as_ylo=2004&as_yhi=2022&as_sdt=5,31&as_vis=1&scipsc=1",34,social desirability
13,"Decomposing self-control: individual differences in goal pursuit despite interfering aversion, temptation, and distraction",TXsMWcSjpCsJ,"R Steimke, C Stelzel, R Gaschler, M Rothkirch… - Frontiers in …, 2016 - frontiersin.org",https://www.frontiersin.org/articles/10.3389/fpsyg.2016.00382/full,"R Steimke, C Stelzel, R Gaschler, M Rothkirch…",2016,"https://scholar.google.com/scholar?q=%22social+desirability%22&cites=6099775482241657013&hl=en&start=860&num=21&as_ylo=2004&as_yhi=2022&as_sdt=5,31&as_vis=1&scipsc=1",34,social desirability
14,Using positive psychology to explain shelter use: A study of homeless families in New York City,s5Fx9Tjc22AJ,D Treglia - 2016 - search.proquest.com,https://search.proquest.com/openview/2f285c69d2ba82363f7ed835497f9f22/1?pq-origsite=gscholar&cbl=18750,D Treglia,2016,"https://scholar.google.com/scholar?q=%22social+desirability%22&cites=6099775482241657013&hl=en&start=860&num=21&as_ylo=2004&as_yhi=2022&as_sdt=5,31&as_vis=1&scipsc=1",34,social desirability
15,I can resist anything except temptation: Self-regulatory fatigue and ethical spending,gIkMw4GCOKMJ,D Crelley - 2013 - ore.exeter.ac.uk,https://ore.exeter.ac.uk/repository/handle/10871/12401,D Crelley,2013,"https://scholar.google.com/scholar?q=%22social+desirability%22&cites=6099775482241657013&hl=en&start=860&num=21&as_ylo=2004&as_yhi=2022&as_sdt=5,31&as_vis=1&scipsc=1",34,social desirability
16,Big data psychology,_UQeIdrkziYJ,R Lavelle-Hill - 2020 - researchgate.net,https://www.researchgate.net/profile/Rosa-Lavelle-Hill/publication/349074103_Big_data_psychology/links/60dd713fa6fdccb745f90aee/Big-data-psychology.pdf,R Lavelle,2020,"https://scholar.google.com/scholar?q=%22social+desirability%22&cites=6099775482241657013&hl=en&start=860&num=21&as_ylo=2004&as_yhi=2022&as_sdt=5,31&as_vis=1&scipsc=1",34,social desirability
17,"‒A Guide to Instructional Techniques, Strategies and Tactics to Manage Learner Affect, Engagement, and Grit",lvt8m0M7jSkJ,"RA Sottilare, JA DeFalco, J Connor - … for intelligent tutoring …, 2014 - books.google.com",https://books.google.com/books?hl=en&lr=&id=BNWEBAAAQBAJ&oi=fnd&pg=PA7&dq=%22social+desirability%22&ots=jKn5HCAp3F&sig=Yjq_-_ed8wYihM4fIRxbGZuPicg,"RA Sottilare, JA DeFalco, J Connor",2014,"https://scholar.google.com/scholar?q=%22social+desirability%22&cites=6099775482241657013&hl=en&start=860&num=21&as_ylo=2004&as_yhi=2022&as_sdt=5,31&as_vis=1&scipsc=1",34,social desirability
18,(Un) healthy lifestyles of Sheffield's residents: Socio-economic and psychosocial deprivation,N9mJdO1z16cJ,J Lešnik - 2020 - search.proquest.com,https://search.proquest.com/openview/46d55a93c325b6c19eae93d2240f7f45/1?pq-origsite=gscholar&cbl=2026366&diss=y,J Lešnik,2020,"https://scholar.google.com/scholar?q=%22social+desirability%22&cites=6099775482241657013&hl=en&start=860&num=21&as_ylo=2004&as_yhi=2022&as_sdt=5,31&as_vis=1&scipsc=1",34,social desirability
19,"A Multimethod Assessment of Effortful Self-Regulation in Personality Research: Temperamental, Neuropsychological, and Psychophysiological Concomitants",5-PfUGjHc6IJ,SA Dinovo Jr - 2009 - rave.ohiolink.edu,https://rave.ohiolink.edu/etdc/view?acc_num=osu1259076504,SA Dinovo Jr,2009,"https://scholar.google.com/scholar?q=%22social+desirability%22&cites=6099775482241657013&hl=en&start=860&num=21&as_ylo=2004&as_yhi=2022&as_sdt=5,31&as_vis=1&scipsc=1",34,social desirability
0,Middle school students' attitudes toward math and STEM career interests: A 4-year follow-up study,345THTb0_xEJ,MR Schneider - 2014 - search.proquest.com,https://search.proquest.com/openview/c7eed5ae8be13924b59757b84029d887/1?pq-origsite=gscholar&cbl=18750,MR Schneider,2014,"https://scholar.google.com/scholar?q=%22social+desirability%22&cites=6099775482241657013&hl=en&start=860&num=21&as_ylo=2004&as_yhi=2022&as_sdt=5,31&as_vis=1&scipsc=1",35,social desirability
1,A scoping review mapping research on green space and associated mental health benefits,9AS7NP0xTh4J,"C Wendelboe-Nelson, S Kelly, M Kennedy… - International Journal of …, 2019 - mdpi.com",https://www.mdpi.com/478574,C Wendelboe,2019,"https://scholar.google.com/scholar?q=%22social+desirability%22&cites=6099775482241657013&hl=en&start=860&num=21&as_ylo=2004&as_yhi=2022&as_sdt=5,31&as_vis=1&scipsc=1",35,social desirability
2,The Predictive Power of Self-Control for Life Outcomes,O_sSy3fLPNwJ,"DA Cobb-Clark, SC Dahmann, DA Kamhöfer… - Journal of Economic …, 2022 - Elsevier",https://www.sciencedirect.com/science/article/pii/S0167268122000828,DA Cobb,2022,"https://scholar.google.com/scholar?q=%22social+desirability%22&cites=6099775482241657013&hl=en&start=860&num=21&as_ylo=2004&as_yhi=2022&as_sdt=5,31&as_vis=1&scipsc=1",35,social desirability
3,The Effect of Mindfulness on the Use of Situation Selection,wF7veTLslrUJ,L Vujović - 2018 - search.proquest.com,https://search.proquest.com/openview/74811d5c9f7caac43edf54c11a72aec7/1?pq-origsite=gscholar&cbl=18750,L Vujović,2018,"https://scholar.google.com/scholar?q=%22social+desirability%22&cites=6099775482241657013&hl=en&start=860&num=21&as_ylo=2004&as_yhi=2022&as_sdt=5,31&as_vis=1&scipsc=1",35,social desirability
4,Adaptive personality regulation: Exploring a new construct and examining its predictive utility,_FPexKsWkRsJ,AR Phillips - 2018 - research.manchester.ac.uk,https://www.research.manchester.ac.uk/portal/files/122862858/FULL_TEXT.PDF,AR Phillips,2018,"https://scholar.google.com/scholar?q=%22social+desirability%22&cites=6099775482241657013&hl=en&start=860&num=21&as_ylo=2004&as_yhi=2022&as_sdt=5,31&as_vis=1&scipsc=1",35,social desirability
5,Goal orientation in job search: Psychometric characteristics and construct validation across job search contexts,_fstY4MJvu8J,"E Affum-Osei, HK Mensah, SK Forkuoh… - International Journal of …, 2021 - Taylor & Francis",https://www.tandfonline.com/doi/abs/10.1080/15305058.2021.1884871,E Affum,2021,"https://scholar.google.com/scholar?q=%22social+desirability%22&cites=6099775482241657013&hl=en&start=860&num=21&as_ylo=2004&as_yhi=2022&as_sdt=5,31&as_vis=1&scipsc=1",35,social desirability
6,Anti-consumption: The lifestyles of the disciplined materialists,75NaN6cwAnsJ,MV Nepomuceno - 2012 - spectrum.library.concordia.ca,https://spectrum.library.concordia.ca/id/eprint/974836/,MV Nepomuceno,2012,"https://scholar.google.com/scholar?q=%22social+desirability%22&cites=6099775482241657013&hl=en&start=860&num=21&as_ylo=2004&as_yhi=2022&as_sdt=5,31&as_vis=1&scipsc=1",35,social desirability
7,"Depression, Risk Preferences and Risk–taking Behavior",pXj5xYfWaKsJ,"DA Cobb-Clark, SC Dahmann… - Journal of Human …, 2021 - jhr.uwpress.org",http://jhr.uwpress.org/content/early/2021/09/15/jhr.58.1.0419-10183R1.abstract,DA Cobb,2021,"https://scholar.google.com/scholar?q=%22social+desirability%22&cites=6099775482241657013&hl=en&start=860&num=21&as_ylo=2004&as_yhi=2022&as_sdt=5,31&as_vis=1&scipsc=1",35,social desirability
