position,title,result_id,publication_info,link,Authors,Year,google_scholar_url,page_number,keyword
10,The erosive effects of racism: reduced self-control mediates the relation between perceived racial discrimination and substance use in African American adolescents.,SCJOBRXc-d8J,"FX Gibbons, RE O'Hara, ML Stock… - Journal of personality …, 2012 - psycnet.apa.org",https://psycnet.apa.org/record/2012-05828-001,"FX Gibbons, RE O'Hara, ML Stock…",2012,"https://scholar.google.com/scholar?q=%22social+desirability%22&cites=6099775482241657013&hl=en&start=860&num=21&as_ylo=2004&as_yhi=2022&as_sdt=5,31&as_vis=1&scipsc=1",11,social desirability
11,What does the narcissistic personality inventory really measure?,qg5FY2JGPDoJ,"RA Ackerman, EA Witt, MB Donnellan… - …, 2011 - journals.sagepub.com",https://journals.sagepub.com/doi/abs/10.1177/1073191110382845,"RA Ackerman, EA Witt, MB Donnellan…",2011,"https://scholar.google.com/scholar?q=%22social+desirability%22&cites=6099775482241657013&hl=en&start=860&num=21&as_ylo=2004&as_yhi=2022&as_sdt=5,31&as_vis=1&scipsc=1",11,social desirability
12,Grit and self-control as predictors of first-year student success,KY68v_TgGGcJ,SB Stewart - 2015 - search.proquest.com,https://search.proquest.com/openview/152bc572d6317501e55d1e097230a4e1/1?pq-origsite=gscholar&cbl=18750,SB Stewart,2015,"https://scholar.google.com/scholar?q=%22social+desirability%22&cites=6099775482241657013&hl=en&start=860&num=21&as_ylo=2004&as_yhi=2022&as_sdt=5,31&as_vis=1&scipsc=1",11,social desirability
13,Assessing decision making in young adult romantic relationships.,2fViyN3gaHkJ,"A Vennum, FD Fincham - Psychological assessment, 2011 - psycnet.apa.org",https://psycnet.apa.org/record/2011-08232-001,"A Vennum, FD Fincham",2011,"https://scholar.google.com/scholar?q=%22social+desirability%22&cites=6099775482241657013&hl=en&start=860&num=21&as_ylo=2004&as_yhi=2022&as_sdt=5,31&as_vis=1&scipsc=1",11,social desirability
14,Role of self-control strength in the relation between anxiety and cognitive performance.,KxmzP7NBrZsJ,"A Bertrams, C Englert, O Dickhäuser, RF Baumeister - Emotion, 2013 - psycnet.apa.org",https://psycnet.apa.org/doiLanding?doi=10.1037/a0031921,"A Bertrams, C Englert, O Dickhäuser, RF Baumeister",2013,"https://scholar.google.com/scholar?q=%22social+desirability%22&cites=6099775482241657013&hl=en&start=860&num=21&as_ylo=2004&as_yhi=2022&as_sdt=5,31&as_vis=1&scipsc=1",11,social desirability
15,Identifying students who are off-track academically in 9th Grade: The role of social-emotional learning trajectories,U9E-JKIyAR8J,"J Soland, M Kuhfeld - grimfetch.com",https://www.grimfetch.com/content/uploads/2020/10/workingpaper-identifying-students-who-are-off-track-academically.pdf,"J Soland, M Kuhfeld",,"https://scholar.google.com/scholar?q=%22social+desirability%22&cites=6099775482241657013&hl=en&start=860&num=21&as_ylo=2004&as_yhi=2022&as_sdt=5,31&as_vis=1&scipsc=1",11,social desirability
16,Self-enhancement: Food for thought,C4w9iAE4YhIJ,"C Sedikides, AP Gregg - Perspectives on Psychological …, 2008 - journals.sagepub.com",https://journals.sagepub.com/doi/abs/10.1111/j.1745-6916.2008.00068.x,"C Sedikides, AP Gregg",2008,"https://scholar.google.com/scholar?q=%22social+desirability%22&cites=6099775482241657013&hl=en&start=860&num=21&as_ylo=2004&as_yhi=2022&as_sdt=5,31&as_vis=1&scipsc=1",11,social desirability
17,Returns to effort: experimental evidence from an online language platform,EbmDJNygN-QJ,"F Ersoy - Experimental Economics, 2021 - Springer",https://link.springer.com/article/10.1007/s10683-020-09689-1,F Ersoy,2021,"https://scholar.google.com/scholar?q=%22social+desirability%22&cites=6099775482241657013&hl=en&start=860&num=21&as_ylo=2004&as_yhi=2022&as_sdt=5,31&as_vis=1&scipsc=1",11,social desirability
18,Toward controlling of a pandemic: How self-control ability influences willingness to take the COVID-19 vaccine,xTxtZLF0-UIJ,"Y Cao, H Li - Personality and Individual Differences, 2022 - Elsevier",https://www.sciencedirect.com/science/article/pii/S0191886921008266,"Y Cao, H Li",2022,"https://scholar.google.com/scholar?q=%22social+desirability%22&cites=6099775482241657013&hl=en&start=860&num=21&as_ylo=2004&as_yhi=2022&as_sdt=5,31&as_vis=1&scipsc=1",11,social desirability
19,Friends know you: Peer nomination of self‐control predict changes in academic achievement and friendship among adolescents,zwUUZOBJNx8J,"D Park, E Tsukayama, BM Galla - Journal of Adolescence, 2022 - Wiley Online Library",https://onlinelibrary.wiley.com/doi/abs/10.1002/jad.12041,"D Park, E Tsukayama, BM Galla",2022,"https://scholar.google.com/scholar?q=%22social+desirability%22&cites=6099775482241657013&hl=en&start=860&num=21&as_ylo=2004&as_yhi=2022&as_sdt=5,31&as_vis=1&scipsc=1",11,social desirability
0,Resource depletion perspective on the link between abusive supervision and safety behaviors,s2RJPzLntjcJ,"X Yuan, Y Xu, Y Li - Journal of Business Ethics, 2020 - Springer",https://link.springer.com/article/10.1007/s10551-018-3983-2,"X Yuan, Y Xu, Y Li",2020,"https://scholar.google.com/scholar?q=%22social+desirability%22&cites=6099775482241657013&hl=en&start=860&num=21&as_ylo=2004&as_yhi=2022&as_sdt=5,31&as_vis=1&scipsc=1",12,social desirability
1,Procrastination out of habit? The role of impulsive versus reflective media selection in procrastinatory media use,CkAOGVzLQQIJ,"A Schnauber-Stockmann, A Meier, L Reinecke - Media Psychology, 2018 - Taylor & Francis",https://www.tandfonline.com/doi/abs/10.1080/15213269.2018.1476156,A Schnauber,2018,"https://scholar.google.com/scholar?q=%22social+desirability%22&cites=6099775482241657013&hl=en&start=860&num=21&as_ylo=2004&as_yhi=2022&as_sdt=5,31&as_vis=1&scipsc=1",12,social desirability
2,Is generosity sincere or strategic? Altruism versus status-seeking in prosocial behavior,YYq9vuYUbVsJ,"R Willer, M Feinberg, FJ Flynn… - Unpublished …, 2011 - researchgate.net",https://www.researchgate.net/profile/Matthew-Feinberg-2/publication/268407221_Is_generosity_sincere_or_strategic_Altruism_versus_status-seeking_in_prosocial_behavior/links/54ff62230cf2672e224636f9/Is-generosity-sincere-or-strategic-Altruism-versus-status-seeking-in-prosocial-behavior.pdf,"R Willer, M Feinberg, FJ Flynn…",2011,"https://scholar.google.com/scholar?q=%22social+desirability%22&cites=6099775482241657013&hl=en&start=860&num=21&as_ylo=2004&as_yhi=2022&as_sdt=5,31&as_vis=1&scipsc=1",12,social desirability
3,Psychological and behavioural factors of unintentional doping: A preliminary systematic review,iUi8r0ggir0J,"DKC Chan, TCW Tang, DF Gucciardi… - … Journal of Sport and …, 2020 - Taylor & Francis",https://www.tandfonline.com/doi/abs/10.1080/1612197X.2018.1450095,"DKC Chan, TCW Tang, DF Gucciardi…",2020,"https://scholar.google.com/scholar?q=%22social+desirability%22&cites=6099775482241657013&hl=en&start=860&num=21&as_ylo=2004&as_yhi=2022&as_sdt=5,31&as_vis=1&scipsc=1",12,social desirability
4,Validation of an implicit measure of antagonistic narcissism,GVIV8Sm4CxsJ,"PE Heinze, R Fatfouta, M Schröder-Abé - Journal of Research in …, 2020 - Elsevier",https://www.sciencedirect.com/science/article/pii/S0092656620300817,"PE Heinze, R Fatfouta, M Schröder",2020,"https://scholar.google.com/scholar?q=%22social+desirability%22&cites=6099775482241657013&hl=en&start=860&num=21&as_ylo=2004&as_yhi=2022&as_sdt=5,31&as_vis=1&scipsc=1",12,social desirability
5,"Debt out of control: The links between self-control, compulsive buying, and real debts",gh7PN3XAxNsJ,"A Achtziger, M Hubert, P Kenning, G Raab… - Journal of Economic …, 2015 - Elsevier",https://www.sciencedirect.com/science/article/pii/S0167487015000471,"A Achtziger, M Hubert, P Kenning, G Raab…",2015,"https://scholar.google.com/scholar?q=%22social+desirability%22&cites=6099775482241657013&hl=en&start=860&num=21&as_ylo=2004&as_yhi=2022&as_sdt=5,31&as_vis=1&scipsc=1",12,social desirability
6,Accepted by Motivation and Emotion,XbExijWl6vQJ,"S Forstmeier, R Drobetz, A Maercker - zora.uzh.ch",https://www.zora.uzh.ch/54849/1/DoG-A_2011-01-21.pdf,"S Forstmeier, R Drobetz, A Maercker",,"https://scholar.google.com/scholar?q=%22social+desirability%22&cites=6099775482241657013&hl=en&start=860&num=21&as_ylo=2004&as_yhi=2022&as_sdt=5,31&as_vis=1&scipsc=1",12,social desirability
7,"Lying behavior, family functioning and adjustment in early adolescence",9XGwq7Zy1IoJ,"RCME Engels, C Finkenauer… - Journal of Youth and …, 2006 - Springer",https://link.springer.com/article/10.1007/s10964-006-9082-1,"RCME Engels, C Finkenauer…",2006,"https://scholar.google.com/scholar?q=%22social+desirability%22&cites=6099775482241657013&hl=en&start=860&num=21&as_ylo=2004&as_yhi=2022&as_sdt=5,31&as_vis=1&scipsc=1",12,social desirability
8,Non‐cognitive skills: Potential candidates for global measurement,KLLLY8uo0vUJ,"K Zhou - European Journal of Education, 2017 - Wiley Online Library",https://onlinelibrary.wiley.com/doi/abs/10.1111/ejed.12241,K Zhou,2017,"https://scholar.google.com/scholar?q=%22social+desirability%22&cites=6099775482241657013&hl=en&start=860&num=21&as_ylo=2004&as_yhi=2022&as_sdt=5,31&as_vis=1&scipsc=1",12,social desirability
9,Development of the Motivation to Participate in Psychological Research Scale,Qp_sNrgWA9IJ,"S Freng - Journal of Individual Differences, 2020 - econtent.hogrefe.com",https://econtent.hogrefe.com/doi/full/10.1027/1614-0001/a000317,S Freng,2020,"https://scholar.google.com/scholar?q=%22social+desirability%22&cites=6099775482241657013&hl=en&start=860&num=21&as_ylo=2004&as_yhi=2022&as_sdt=5,31&as_vis=1&scipsc=1",12,social desirability
10,“WHY DID YOU MAKE ME DO THAT?” ANGER AT GOD IN THE CONTEXT OF MORAL TRANSGRESSION,5Fldpa2AyUMJ,JB Grubbs - 2012 - rave.ohiolink.edu,https://rave.ohiolink.edu/etdc/view?acc_num=case1333495047,JB Grubbs,2012,"https://scholar.google.com/scholar?q=%22social+desirability%22&cites=6099775482241657013&hl=en&start=860&num=21&as_ylo=2004&as_yhi=2022&as_sdt=5,31&as_vis=1&scipsc=1",12,social desirability
11,Personality and alcohol use: The role of impulsivity,gZyaCcuI7_IJ,"SH Shin, HG Hong, SM Jeon - Addictive behaviors, 2012 - Elsevier",https://www.sciencedirect.com/science/article/pii/S0306460311002917,"SH Shin, HG Hong, SM Jeon",2012,"https://scholar.google.com/scholar?q=%22social+desirability%22&cites=6099775482241657013&hl=en&start=860&num=21&as_ylo=2004&as_yhi=2022&as_sdt=5,31&as_vis=1&scipsc=1",12,social desirability
12,An ego effectiveness perspective of successful self-control: An individual difference and its links to social functioning and well-being,76mQ0WoKdCwJ,"MD Robinson, MR Persich, RL Irvin - Journal of Research in Personality, 2022 - Elsevier",https://www.sciencedirect.com/science/article/pii/S0092656622000204,"MD Robinson, MR Persich, RL Irvin",2022,"https://scholar.google.com/scholar?q=%22social+desirability%22&cites=6099775482241657013&hl=en&start=860&num=21&as_ylo=2004&as_yhi=2022&as_sdt=5,31&as_vis=1&scipsc=1",12,social desirability
13,Drinking like everyone else: Trait self-control moderates the association between peer and personal heavy episodic drinking,yPXOwILZmNMJ,"E Robinson, A Jones, P Christiansen… - Substance use & …, 2015 - Taylor & Francis",https://www.tandfonline.com/doi/abs/10.3109/10826084.2014.991407,"E Robinson, A Jones, P Christiansen…",2015,"https://scholar.google.com/scholar?q=%22social+desirability%22&cites=6099775482241657013&hl=en&start=860&num=21&as_ylo=2004&as_yhi=2022&as_sdt=5,31&as_vis=1&scipsc=1",12,social desirability
14,"Examining relationships between facial emotion recognition, self-control, and psychopathic traits in a non-clinical sample",OJAzqTYQvLIJ,"CE Prado, MS Treeby, SF Crowe - Personality and Individual Differences, 2015 - Elsevier",https://www.sciencedirect.com/science/article/pii/S0191886915001051,"CE Prado, MS Treeby, SF Crowe",2015,"https://scholar.google.com/scholar?q=%22social+desirability%22&cites=6099775482241657013&hl=en&start=860&num=21&as_ylo=2004&as_yhi=2022&as_sdt=5,31&as_vis=1&scipsc=1",12,social desirability
15,How does power corrupt?: the way individual and institutional support of social hierarchies influences unethical behavior,TpBm4XB7yPsJ,V Rosenblatt - 2012 - scholarspace.manoa.hawaii.edu,https://scholarspace.manoa.hawaii.edu/handle/10125/101023,V Rosenblatt,2012,"https://scholar.google.com/scholar?q=%22social+desirability%22&cites=6099775482241657013&hl=en&start=860&num=21&as_ylo=2004&as_yhi=2022&as_sdt=5,31&as_vis=1&scipsc=1",12,social desirability
16,A social identity analysis of disordered eating behaviour,77Vh3n5wD7oJ,TL Cruwys - 2013 - openresearch-repository.anu.edu.au,https://openresearch-repository.anu.edu.au/handle/1885/155850,TL Cruwys,2013,"https://scholar.google.com/scholar?q=%22social+desirability%22&cites=6099775482241657013&hl=en&start=860&num=21&as_ylo=2004&as_yhi=2022&as_sdt=5,31&as_vis=1&scipsc=1",12,social desirability
17,Impulsivity and the self-defeating behavior of narcissists,-HpLKYFt8MQJ,"S Vazire, DC Funder - Personality and social psychology …, 2006 - journals.sagepub.com",https://journals.sagepub.com/doi/abs/10.1207/s15327957pspr1002_4,"S Vazire, DC Funder",2006,"https://scholar.google.com/scholar?q=%22social+desirability%22&cites=6099775482241657013&hl=en&start=860&num=21&as_ylo=2004&as_yhi=2022&as_sdt=5,31&as_vis=1&scipsc=1",12,social desirability
18,Prefrontal Cortex and Risk Taking Lorena RR Gianotti et al. Research Report,-czJBsfF_zoJ,"LRR Gianotti, D Knoch, PL Faber, D Lehmann… - Citeseer",http://citeseerx.ist.psu.edu/viewdoc/download?doi=10.1.1.584.2208&rep=rep1&type=pdf,"LRR Gianotti, D Knoch, PL Faber, D Lehmann…",,"https://scholar.google.com/scholar?q=%22social+desirability%22&cites=6099775482241657013&hl=en&start=860&num=21&as_ylo=2004&as_yhi=2022&as_sdt=5,31&as_vis=1&scipsc=1",12,social desirability
19,Compulsive Buying Behaviour in relation to Self Control and Generalized Self Efficacy among Young Professionals,yOL_xmxsrDoJ,"S Kaur, P Singh - International Journal of Research in Social …, 2018 - indianjournals.com",https://www.indianjournals.com/ijor.aspx?target=ijor:ijrss&volume=8&issue=3&article=030,"S Kaur, P Singh",2018,"https://scholar.google.com/scholar?q=%22social+desirability%22&cites=6099775482241657013&hl=en&start=860&num=21&as_ylo=2004&as_yhi=2022&as_sdt=5,31&as_vis=1&scipsc=1",12,social desirability
0,Self-Control Motivation and Capacity Scale: A new measure of multiple facets of self-control,wXOneyMGxaEJ,A Papova - 2016 - search.proquest.com,https://search.proquest.com/openview/4f578556bfc18b93d4326c5178a2298a/1?pq-origsite=gscholar&cbl=18750,A Papova,2016,"https://scholar.google.com/scholar?q=%22social+desirability%22&cites=6099775482241657013&hl=en&start=860&num=21&as_ylo=2004&as_yhi=2022&as_sdt=5,31&as_vis=1&scipsc=1",13,social desirability
1,Assessment of the Sailor Evaluation Tool (SET),LbPGz-XAlJ4J,"NL Shattuck, P Matsangas - 2018 - apps.dtic.mil",https://apps.dtic.mil/sti/citations/AD1073573,"NL Shattuck, P Matsangas",2018,"https://scholar.google.com/scholar?q=%22social+desirability%22&cites=6099775482241657013&hl=en&start=860&num=21&as_ylo=2004&as_yhi=2022&as_sdt=5,31&as_vis=1&scipsc=1",13,social desirability
2,Self-control at work: its relationship with contextual performance,U3rgBOLPoxwJ,"BJ De Boer, EAJ Van Hooft, AB Bakker - Journal of managerial …, 2015 - emerald.com",https://www.emerald.com/insight/content/doi/10.1108/JMP-08-2012-0237/full/html,"BJ De Boer, EAJ Van Hooft, AB Bakker",2015,"https://scholar.google.com/scholar?q=%22social+desirability%22&cites=6099775482241657013&hl=en&start=860&num=21&as_ylo=2004&as_yhi=2022&as_sdt=5,31&as_vis=1&scipsc=1",13,social desirability
3,"Descriptive peer norms, self-control and dietary behaviour in young adults",gCWhv-cx-ckJ,"E Robinson, R Otten, RCJ Hermans - Psychology & health, 2016 - Taylor & Francis",https://www.tandfonline.com/doi/abs/10.1080/08870446.2015.1067705,"E Robinson, R Otten, RCJ Hermans",2016,"https://scholar.google.com/scholar?q=%22social+desirability%22&cites=6099775482241657013&hl=en&start=860&num=21&as_ylo=2004&as_yhi=2022&as_sdt=5,31&as_vis=1&scipsc=1",13,social desirability
4,Stop and start control: A distinction within self–control,urOM28_mkFYJ,"BJ de Boer, EAJ Van Hooft… - European Journal of …, 2011 - journals.sagepub.com",https://journals.sagepub.com/doi/abs/10.1002/per.796,"BJ de Boer, EAJ Van Hooft…",2011,"https://scholar.google.com/scholar?q=%22social+desirability%22&cites=6099775482241657013&hl=en&start=860&num=21&as_ylo=2004&as_yhi=2022&as_sdt=5,31&as_vis=1&scipsc=1",13,social desirability
5,"The relationship between time perspective and self-regulatory processes, abilities and outcomes: a protocol for a meta-analytical review",3jVsroqtPIUJ,"HM Baird, TL Webb, J Martin, FM Sirois - BMJ open, 2017 - bmjopen.bmj.com",https://bmjopen.bmj.com/content/7/6/e017000.abstract,"HM Baird, TL Webb, J Martin, FM Sirois",2017,"https://scholar.google.com/scholar?q=%22social+desirability%22&cites=6099775482241657013&hl=en&start=860&num=21&as_ylo=2004&as_yhi=2022&as_sdt=5,31&as_vis=1&scipsc=1",13,social desirability
6,Sedentary behavior and problematic smartphone use in Chinese adolescents: The moderating role of self-control,ze8AA1QcUXwJ,"MQ Xiang, L Lin, ZR Wang, J Li, Z Xu, M Hu - Frontiers in Psychology, 2020 - frontiersin.org",https://www.frontiersin.org/articles/10.3389/fpsyg.2019.03032/full,"MQ Xiang, L Lin, ZR Wang, J Li, Z Xu, M Hu",2020,"https://scholar.google.com/scholar?q=%22social+desirability%22&cites=6099775482241657013&hl=en&start=860&num=21&as_ylo=2004&as_yhi=2022&as_sdt=5,31&as_vis=1&scipsc=1",13,social desirability
7,Higher heart-rate variability is associated with ventromedial prefrontal cortex activity and increased resistance to temptation in dietary self-control challenges,tY0P3cDKoNIJ,"SU Maier, TA Hare - Journal of Neuroscience, 2017 - Soc Neuroscience",https://www.jneurosci.org/content/37/2/446.abstract,"SU Maier, TA Hare",2017,"https://scholar.google.com/scholar?q=%22social+desirability%22&cites=6099775482241657013&hl=en&start=860&num=21&as_ylo=2004&as_yhi=2022&as_sdt=5,31&as_vis=1&scipsc=1",13,social desirability
8,Mindfulness and sleep quality in adolescents: Analysis of rumination as a mediator and self-control as a moderator,vLE27fDyD-0J,"QQ Liu, ZK Zhou, XJ Yang, FC Kong, XJ Sun… - Personality and …, 2018 - Elsevier",https://www.sciencedirect.com/science/article/pii/S0191886917306372,"QQ Liu, ZK Zhou, XJ Yang, FC Kong, XJ Sun…",2018,"https://scholar.google.com/scholar?q=%22social+desirability%22&cites=6099775482241657013&hl=en&start=860&num=21&as_ylo=2004&as_yhi=2022&as_sdt=5,31&as_vis=1&scipsc=1",13,social desirability
9,RANDOMIZING RELIGION: THE IMPACT OF PROTESTANT EVANGELISM ON ECONOMIC OUTCOMES GHARAD BRYAN JAMES J. CHOI,6A45QYBFVNoJ,"D KARLAN - The Quarterly Journal of Economics, 2020 - spinup-000d1a-wp-offload-media.s3 …",http://spinup-000d1a-wp-offload-media.s3.amazonaws.com/faculty/wp-content/uploads/sites/27/2019/06/ICM-1.pdf,D KARLAN,,"https://scholar.google.com/scholar?q=%22social+desirability%22&cites=6099775482241657013&hl=en&start=860&num=21&as_ylo=2004&as_yhi=2022&as_sdt=5,31&as_vis=1&scipsc=1",13,social desirability
10,Are media exposure and self-control related?,G2kaIUlopnIJ,J House - 2011 - scholar.archive.org,https://scholar.archive.org/work/pootumibyjg5djsfgia4ctiv6q/access/wayback/https://s3.ca-central-1.amazonaws.com/pstorage-ryerson-5010877717/28129131/House_Julian.pdf,J House,2011,"https://scholar.google.com/scholar?q=%22social+desirability%22&cites=6099775482241657013&hl=en&start=860&num=21&as_ylo=2004&as_yhi=2022&as_sdt=5,31&as_vis=1&scipsc=1",13,social desirability
11,Compensatory Health Beliefs Relate to Decision-Making Coherence and Health Patterns,1xt6rsn9axoJ,"BD Merillat, C González-Vallejo - The Ohio Journal of Science, 2019 - search.proquest.com",https://search.proquest.com/openview/f294b38f235e7c4cb2d12c023e7650b8/1?pq-origsite=gscholar&cbl=60399,"BD Merillat, C González",2019,"https://scholar.google.com/scholar?q=%22social+desirability%22&cites=6099775482241657013&hl=en&start=860&num=21&as_ylo=2004&as_yhi=2022&as_sdt=5,31&as_vis=1&scipsc=1",13,social desirability
12,Unpacking the perceived opportunity to misbehave: The influence of spatio-temporal and social dimensions on consumer misbehavior,SL2o3w0WRd8J,"KL Daunt, DA Greer - European Journal of Marketing, 2015 - emerald.com",https://www.emerald.com/insight/content/doi/10.1108/EJM-01-2014-0061/full/html,"KL Daunt, DA Greer",2015,"https://scholar.google.com/scholar?q=%22social+desirability%22&cites=6099775482241657013&hl=en&start=860&num=21&as_ylo=2004&as_yhi=2022&as_sdt=5,31&as_vis=1&scipsc=1",13,social desirability
13,The effect of mental availability on snack food choices,uDr12ajh3XQJ,"L Stocchi, E Kemps, Z Anesbury - Journal of Retailing and Consumer …, 2021 - Elsevier",https://www.sciencedirect.com/science/article/pii/S0969698921000370,"L Stocchi, E Kemps, Z Anesbury",2021,"https://scholar.google.com/scholar?q=%22social+desirability%22&cites=6099775482241657013&hl=en&start=860&num=21&as_ylo=2004&as_yhi=2022&as_sdt=5,31&as_vis=1&scipsc=1",13,social desirability
14,Implications of Catholic Anthropology for Psychological Assessment,nYnM0IEBurgJ,"FJ Moncher - Edification, 2009 - researchgate.net",https://www.researchgate.net/profile/Christian-Brugger/publication/280839204_Psychology_and_Christian_Anthropology/links/55edb39e08aef559dc423fef/Psychology-and-Christian-Anthropology.pdf#page=69,FJ Moncher,2009,"https://scholar.google.com/scholar?q=%22social+desirability%22&cites=6099775482241657013&hl=en&start=860&num=21&as_ylo=2004&as_yhi=2022&as_sdt=5,31&as_vis=1&scipsc=1",13,social desirability
15,Effects of a prevention program for internet addiction among middle school students in South Korea,XOxNlO98NJQJ,"SY Yang, HS Kim - Public Health Nursing, 2018 - Wiley Online Library",https://onlinelibrary.wiley.com/doi/abs/10.1111/phn.12394,"SY Yang, HS Kim",2018,"https://scholar.google.com/scholar?q=%22social+desirability%22&cites=6099775482241657013&hl=en&start=860&num=21&as_ylo=2004&as_yhi=2022&as_sdt=5,31&as_vis=1&scipsc=1",13,social desirability
16,Brain correlates of subjective freedom of choice,hiCdVHxBu7cJ,"E Filevich, P Vanneste, M Brass, W Fias… - Consciousness and …, 2013 - Elsevier",https://www.sciencedirect.com/science/article/pii/S1053810013001244,"E Filevich, P Vanneste, M Brass, W Fias…",2013,"https://scholar.google.com/scholar?q=%22social+desirability%22&cites=6099775482241657013&hl=en&start=860&num=21&as_ylo=2004&as_yhi=2022&as_sdt=5,31&as_vis=1&scipsc=1",13,social desirability
17,"Main and moderating effects of self-control, organizational justice, and emotional labour on counterproductive behaviour at work",gKVZU_6FF8gJ,"MN Bechtoldt, C Welk, D Zapf… - European Journal of Work …, 2007 - Taylor & Francis",https://www.tandfonline.com/doi/abs/10.1080/13594320701662618,"MN Bechtoldt, C Welk, D Zapf…",2007,"https://scholar.google.com/scholar?q=%22social+desirability%22&cites=6099775482241657013&hl=en&start=860&num=21&as_ylo=2004&as_yhi=2022&as_sdt=5,31&as_vis=1&scipsc=1",13,social desirability
18,A behavioral-systems perspective on prosocial behavior.,9f7M25fKsIoJ,"PR Shaver, M Mikulincer, M Shemesh-Iron - 2010 - psycnet.apa.org",https://psycnet.apa.org/record/2009-08941-004,"PR Shaver, M Mikulincer, M Shemesh",2010,"https://scholar.google.com/scholar?q=%22social+desirability%22&cites=6099775482241657013&hl=en&start=860&num=21&as_ylo=2004&as_yhi=2022&as_sdt=5,31&as_vis=1&scipsc=1",13,social desirability
19,The Effect of Construal Level on Consumers' Anticipated (Un) Ethical Behavior,WTo6-rVrdXcJ,N Amaral - 2013 - conservancy.umn.edu,https://conservancy.umn.edu/handle/11299/174870,N Amaral,2013,"https://scholar.google.com/scholar?q=%22social+desirability%22&cites=6099775482241657013&hl=en&start=860&num=21&as_ylo=2004&as_yhi=2022&as_sdt=5,31&as_vis=1&scipsc=1",13,social desirability
0,The Regulatory Effect of Awe: Awe Predicts Enhanced Ability to Resist Food Indulgence,V7X9qOMQH4oJ,Y Zhaoliang - 2021 - search.proquest.com,https://search.proquest.com/openview/1554ed064de1b05ba00cafdfb74d6fad/1?pq-origsite=gscholar&cbl=2026366&diss=y,Y Zhaoliang,2021,"https://scholar.google.com/scholar?q=%22social+desirability%22&cites=6099775482241657013&hl=en&start=860&num=21&as_ylo=2004&as_yhi=2022&as_sdt=5,31&as_vis=1&scipsc=1",14,social desirability
1,Individual differences in emotional mimicry: Underlying traits and social consequences,OUnlkAnPcqcJ,"H Mauersberger, C Blaison… - European Journal …, 2015 - journals.sagepub.com",https://journals.sagepub.com/doi/abs/10.1002/per.2008,"H Mauersberger, C Blaison…",2015,"https://scholar.google.com/scholar?q=%22social+desirability%22&cites=6099775482241657013&hl=en&start=860&num=21&as_ylo=2004&as_yhi=2022&as_sdt=5,31&as_vis=1&scipsc=1",14,social desirability
2,"Taking the long view: Implications of individual differences in temporal distancing for affect, stress reactivity, and well-being.",U7T0qirO-gIJ,"E Bruehlman-Senecal, Ö Ayduk… - Journal of Personality and …, 2016 - psycnet.apa.org",https://psycnet.apa.org/doiLanding?doi=10.1037%2Fpspp0000103,E Bruehlman,2016,"https://scholar.google.com/scholar?q=%22social+desirability%22&cites=6099775482241657013&hl=en&start=860&num=21&as_ylo=2004&as_yhi=2022&as_sdt=5,31&as_vis=1&scipsc=1",14,social desirability
3,"Self‐regulatory ability, fatigue, and the experience of pain: Mechanistic insights from pain‐free undergraduates",L0Df6S9Kv6MJ,"IA Boggero, SC Segerstrom - Psychophysiology, 2019 - Wiley Online Library",https://onlinelibrary.wiley.com/doi/abs/10.1111/psyp.13388,"IA Boggero, SC Segerstrom",2019,"https://scholar.google.com/scholar?q=%22social+desirability%22&cites=6099775482241657013&hl=en&start=860&num=21&as_ylo=2004&as_yhi=2022&as_sdt=5,31&as_vis=1&scipsc=1",14,social desirability
