"Item type","Authors","Editors","Title","Journal","Publication year","Volume","Issue","Pages","Publisher","Address","Book title","Date published","ISBN","ISSN","URLs","DOI","Abstract","Keywords","Notes","Series"
"Journal Article","Kashdan TB,Rottenberg J","","Psychological flexibility as a fundamental aspect of health","Clinical Psychology Review","2010","30","7","865-878","","","","2010","","0272-7358","https://www.sciencedirect.com/science/article/pii/S0272735810000413;http://dx.doi.org/10.1016/j.cpr.2010.03.001","10.1016/j.cpr.2010.03.001","Traditionally, positive emotions and thoughts, strengths, and the satisfaction of basic psychological needs for belonging, competence, and autonomy have been seen as the cornerstones of psychological health. Without disputing their importance, these foci fail to capture many of the fluctuating, conflicting forces that are readily apparent when people navigate the environment and social world. In this paper, we review literature to offer evidence for the prominence of psychological flexibility in understanding psychological health. Thus far, the importance of psychological flexibility has been obscured by the isolation and disconnection of research conducted on this topic. Psychological flexibility spans a wide range of human abilities to: recognize and adapt to various situational demands; shift mindsets or behavioral repertoires when these strategies compromise personal or social functioning; maintain balance among important life domains; and be aware, open, and committed to behaviors that are congruent with deeply held values. In many forms of psychopathology, these flexibility processes are absent. In hopes of creating a more coherent understanding, we synthesize work in emotion regulation, mindfulness and acceptance, social and personality psychology, and neuropsychology. Basic research findings provide insight into the nature, correlates, and consequences of psychological flexibility and applied research provides details on promising interventions. Throughout, we emphasize dynamic approaches that might capture this fluid construct in the real-world.","Flexibility, Self-regulation, Emotion regulation, Mindfulness, Resilience, Vulnerability","Positive Clinical Psychology",""
"Journal Article","Wang M,Deng X,Du X","","Harsh parenting and academic achievement in Chinese adolescents: Potential mediating roles of effortful control and classroom engagement","Journal of School Psychology","2018","67","","16-30","","","","2018","","0022-4405","https://www.sciencedirect.com/science/article/pii/S002244051730095X;http://dx.doi.org/10.1016/j.jsp.2017.09.002","10.1016/j.jsp.2017.09.002","This study examined (a) the potential mediating roles of effortful control and classroom engagement in the association between harsh parenting and adolescent academic achievement, and (b) the potential moderating role of gender. Sixth through eighth graders in rural China (n=815, mean age=12.55years) reported on harsh parenting, effortful control, and classroom engagement. Parents also reported on each other's harsh parenting. Academic achievement was assessed by students' test scores and teacher-rated academic performance. Results of structural equation modeling revealed gender differences in patterns of association among the model variables. Harsh parenting was negatively and directly associated with academic achievement for both boys and girls. It was also negatively and indirectly associated with academic achievement via effortful control and classroom engagement sequentially, forming a common indirect “path” for boys and girls. The indirect negative effect of harsh parenting on boys' academic achievement was mainly realized through the mediator of effortful control, whereas this same indirect effect for girls was mainly realized through the mediator of classroom engagement. Jointly, effortful control and classroom engagement precipitates more indirect effects for boys than for girls in the association between harsh parenting and academic achievement. The discussion analyzes the potential “paths” from harsh parenting to adolescent academic achievement, as well as gender differences in these “paths.” The current study has implications for teachers and parents eager to improve students' classroom engagement and academic achievement.","Harsh parenting, Academic achievement, Effortful control, Classroom engagement","",""
"Journal Article","Achtziger A,Alós-Ferrer C,Wagner AK","","The impact of self-control depletion on social preferences in the ultimatum game","Journal of Economic Psychology","2016","53","","1-16","","","","2016","","0167-4870","https://www.sciencedirect.com/science/article/pii/S0167487015001476;http://dx.doi.org/10.1016/j.joep.2015.12.005","10.1016/j.joep.2015.12.005","We study the interaction of different motives and decision processes in determining behavior in the ultimatum game. We rely on an ego-depletion manipulation which consumes self-control resources, thereby enhancing the influence of default reactions, or in psychological terms, automatic processes. Experimental results provide evidence that proposers make higher offers under ego depletion. Based on findings from a closely related dictator game study, which shows that depleted dictators give less than non-depleted ones, we discard the possibility that other-regarding concerns are the default mode. Instead, we conclude that depleted proposers offer more because of a strategic ‘fear of rejection’ of low offers, consistent with self-centered monetary concerns. For responders, ego depletion increases the likelihood to accept offers, in line with unconditional monetary concerns being more automatic than affect-influenced reactions to reject unfair offers.","Ultimatum game, Self-control, Ego depletion, Social preferences","",""
"Journal Article","Mumford EA,Taylor BG,Berg M,Liu W,Miesfeld N","","The social anatomy of adverse childhood experiences and aggression in a representative sample of young adults in the U.S","Child Abuse & Neglect","2019","88","","15-27","","","","2019","","0145-2134","https://www.sciencedirect.com/science/article/pii/S0145213418304046;http://dx.doi.org/10.1016/j.chiabu.2018.10.016","10.1016/j.chiabu.2018.10.016","Objective The current study assesses the effect of adverse childhood experiences on later aggression and violence across young adult relationships contexts, including intimate partners, friends, or strangers. Method Surveys were conducted with a nationally representative sample of young adults ages 18–32, drawn from the AmeriSpeak panel, a probability-based panel with coverage of 97% of U.S. households. The weighted study sample is 2284 young adult respondents, of whom 1561 reported being in an intimate partnership. Results Rates of verbal aggression perpetrated by young adults declined with the intimacy of the relationship, such that aggression against a partner (72%) exceeded aggression directed at friends (43%) and strangers (34%). Similar rates of physical violence (about 9%) were reportedly perpetrated against partners, friends, and strangers. Adjusting for a range of personal characteristics, both adverse childhood experiences and recent stressors in these young adult lives exhibited direct associations with verbal and physically aggressive outcomes. Conclusions In models of verbal and physical aggression across relationship contexts, childhood adversity exhibits lasting effects unaccounted for by important proximal life circumstances, including recent life stressors, mental health, and substance use behaviors. These results provide empirical insights for clinical treatment of young adults prone to aggressive conflicts as well as input to positive youth development programming to foster healthy approaches to conflict.","Verbal aggression, Physical violence, Intimate partner violence, Young adult relationships, Adverse childhood experiences, Life stressors, Interpersonal conflict","",""
"Book Chapter","","Hackfort D,Schinke RJ,Strauss B","S","","2019","","","255-292","Academic Press","","Dictionary of Sport Psychology","2019","9780128131503","","https://www.sciencedirect.com/science/article/pii/B978012813150300019X;http://dx.doi.org/10.1016/B978-0-12-813150-3.00019-X","10.1016/B978-0-12-813150-3.00019-X","","","",""
"Journal Article","Zabelina DL,Robinson MD,Anicha CL","","The psychological tradeoffs of self-control: A multi-method investigation","Personality and Individual Differences","2007","43","3","463-473","","","","2007","","0191-8869","https://www.sciencedirect.com/science/article/pii/S0191886907000049;http://dx.doi.org/10.1016/j.paid.2006.12.015","10.1016/j.paid.2006.12.015","A recent measure of self-control seeks to tap individual differences in the ability to override impulse and emotion (Tangney, Baumeister, & Boone, 2004). The importance of this individual difference variable is potentially very large in domains such as emotion, psychopathology, academic success, and interpersonal functioning. The present study (N=52) seeks to extend our knowledge of this individual difference variable and seeks to do so in relation to a hot/cool analysis of the construct. On the “hot” side, the study examined relations between self-control and daily affective experience, and did so in a relatively implicit manner. On the “cool” side, the study examined relations between self-control and personality consistency, and did so using multiple methods. Supporting hypotheses, findings indicated that individuals high in self-control reported less affect in their daily lives, were more consistent in their traits, and were viewed as less spontaneous and extraverted by informants. Thus, there seems to be a hot/cool tradeoff in that self-control promotes consistency, but at the expense of affect and spontaneity.","Personality, Self-control, Affect, Emotion, Language, Congruence, Informants","",""
"Journal Article","Restubog SL,Garcia PR,Wang L,Cheng D","","It’s all about control: The role of self-control in buffering the effects of negative reciprocity beliefs and trait anger on workplace deviance","Journal of Research in Personality","2010","44","5","655-660","","","","2010","","0092-6566","https://www.sciencedirect.com/science/article/pii/S0092656610000905;http://dx.doi.org/10.1016/j.jrp.2010.06.007","10.1016/j.jrp.2010.06.007","Drawing upon the general aggression model, general theory of crime, and the integrative cognitive model of trait anger, we examined the role of self-control in buffering the effects of negative reciprocity beliefs and trait anger on workplace deviance. A total of 125 employees participated in the study. Results supported the hypothesized direct effects of negative reciprocity beliefs, trait anger, and self-control on archival data on workplace deviance. In addition, self-control moderated these relationships. Specifically, there was a weaker positive relationship between negative reciprocity beliefs, trait anger and workplace deviance for employees with high as opposed to low levels of self-control. These findings supported the view that self-control can override predispositions to engage in deviant behaviors.","Aggression, Negative reciprocity, Trait anger, Self-control, Individual differences","",""
"Journal Article","Prado CE,Treeby MS,Crowe SF","","Examining relationships between facial emotion recognition, self-control, and psychopathic traits in a non-clinical sample","Personality and Individual Differences","2015","80","","22-27","","","","2015","","0191-8869","https://www.sciencedirect.com/science/article/pii/S0191886915001051;http://dx.doi.org/10.1016/j.paid.2015.02.013","10.1016/j.paid.2015.02.013","Although psychopathy is a low prevalence disorder, individuals with sub-clinical psychopathic traits have been shown to reside within the community. One account of psychopathy proposes that deficits in self-control play a causal role. Other theorists propose that psychopathy-related antisocial behaviour can be attributed to a constitutional deficit of empathy, resulting from an inability to interpret and respond to the affective cues of others. These theoretical perspectives may both be relevant if psychopathy is understood as a dimensional construct, with primary psychopathy the consequence of a neurological vulnerability to emotional deficits, and secondary psychopathy reflecting an environmental adaptation and subsequent failure of self-control. Using a non-clinical sample (n=479), this study examined the relationship between sub-clinical psychopathic traits, self-control and the identification of facial emotion. Both primary and secondary psychopathic traits were associated with reduced accuracy in identifying facial affect, with more pronounced impairments seen for primary psychopathy. While both primary and secondary psychopathic traits were found to be related to deficits in dispositional self-control, the effect was significantly greater for secondary psychopathy.","Psychopathy, Psychopathic personality traits, Facial emotion recognition, Primary and secondary psychopathy, Self-control deficits, Emotion perception, Non-clinical sample","",""
"Book Chapter","Baumeister RF,Monroe AE","Olson JM,Zanna MP","Chapter One - Recent Research on Free Will: Conceptualizations, Beliefs, and Processes","","2014","50","","1-52","Academic Press","","","2014","","0065-2601","https://www.sciencedirect.com/science/article/pii/B9780128002841000011;http://dx.doi.org/10.1016/B978-0-12-800284-1.00001-1","10.1016/B978-0-12-800284-1.00001-1","This chapter summarizes research on free will. Progress has been made by discarding outmoded philosophical notions in favor of exploring how ordinary people understand and use the notion of free will. The concept of responsible autonomy captures many aspects of layperson concepts of free will, including acting on one's own (i.e., not driven by external forces), choosing, using reasons and personal values, conscious reflection, and knowing and accepting consequences and moral implications. Free will can thus be understood as form of volition (action control) that evolved to enable people to live in cultural societies. Much work has shown that belief in free will (as opposed to disbelief) is associated with actions that are conducive to functioning well in culture, including helpfulness, restraint of aggression, learning via counterfactual analysis, thinking for oneself, effective job performance, and appropriate gratitude. Belief in free will increases in response to misdeeds by others, thus emphasizing the link to personal responsibility. Research on volition indicates that self-regulation, intelligent reasoning, decision making, and initiative all deplete a (common) limited energy source, akin to the folk notion of willpower and linked to the body's glucose supplies. Free will is thus not an absolute or constant property of persons but a variable, fluctuating capability—one that is nonetheless highly adaptive for individuals and society. The notion that people have free will has been invoked in multiple contexts. Legally and morally, it explains why people can be held responsible for their actions. Theologically, it was used to explain why a supposedly kind and omniscient god would send most of the people he created to hell (Walker, 1964). Yet, for such an important concept, there remains wide-ranging disagreement and confusion over its existence and its nature. For example, philosophers still debate whether humans truly have free will and, if so, under what conditions human volition deserves to be considered free (Kane, 2011). In psychology, most theorists believe that humans engage in self-control, rational choice, planning, initiative, and related acts of volition. The debate is not whether these things occur but merely whether these should be called free will. This chapter will provide an overview of recent psychology experiments concerned with free will. There are three main and quite distinct sets of problems, each with associated lines of research. The first is concerned with how people understand the idea of free will. The second concerns the causes and consequences of believing in free will. The third focuses on the actual volitional processes that guide human action.","Free will, Volition, Self-regulation, Decision making, Depletion","","Advances in Experimental Social Psychology"
"Journal Article","Kauser R,Pinquart M","","Effectiveness of an indigenous parent training program on change in parenting styles and delinquent tendencies (challenging behaviors) in Pakistan: A randomized controlled trial","Journal of Experimental Child Psychology","2019","188","","104677","","","","2019","","0022-0965","https://www.sciencedirect.com/science/article/pii/S0022096518305460;http://dx.doi.org/10.1016/j.jecp.2019.104677","10.1016/j.jecp.2019.104677","The effectiveness of an indigenous parent training program was examined within selected Pakistani families. For this purpose, 110 parents of adolescents with above-average levels of delinquent tendencies (challenging behaviors), who were screened and chosen from five randomly selected schools in Lahore, Punjab, Pakistan, participated in the study. The adolescents’ parents were randomly placed into either an intervention group or a control group. Members of the intervention group participated in seven sessions of parent training, which aimed to increase behaviors associated with an authoritative parenting style. Findings show that participants in the parent training program displayed an increase in authoritative parenting behaviors and a decrease in authoritarian and neglectful parenting behaviors at both posttest and follow-up. In addition, their children showed reductions in parent-reported challenging behaviors. Declines in challenging behaviors were explained by increases in authoritative parenting behaviors, although not all intervention effects could be explained by such increases. We conclude that, similar to Western countries, the authoritative parenting style is the most effective parenting style for managing adolescents’ challenging behaviors in Pakistan.","Parent training, Authoritative parenting, Adolescents’ challenging behaviors, Indigenous, Intervention and control groups, Randomization","",""
"Journal Article","Tong EM,Tan KW,Chor AA,Koh EP,Lee JS,Tan RW","","Humility facilitates higher self-control","Journal of Experimental Social Psychology","2016","62","","30-39","","","","2016","","0022-1031","https://www.sciencedirect.com/science/article/pii/S0022103115001183;http://dx.doi.org/10.1016/j.jesp.2015.09.008","10.1016/j.jesp.2015.09.008","Prior evidence and existing theories imply that humility engenders intra- and inter-personal attributes that facilitate self-regulatory abilities. Four experiments were conducted to test the hypothesis that humility predicts enhanced self-control. Participants who recalled humility experiences were found to be better able at sustaining their physical stamina in a handgrip task (Studies 1 and 4), resisting indulgence in chocolates (Study 2), and persevering in a frustrating tracing task (Study 3) than those who recalled neutral experiences. Studies 3 and 4 demonstrated that the effect of humility was distinct from that of self-esteem, which did not affect self-control. Study 2 ruled out two alternative hypotheses concerning achievement and compliance motives. We discuss how the findings might relate to outcomes associated with humility as evidenced in past studies.","Humility, Self-Control, Self-Esteem","",""
"Journal Article","Uziel L","","Life seems different with you around: Differential shifts in cognitive appraisal in the mere presence of others for neuroticism and impression management","Personality and Individual Differences","2015","73","","39-43","","","","2015","","0191-8869","https://www.sciencedirect.com/science/article/pii/S019188691400525X;http://dx.doi.org/10.1016/j.paid.2014.09.023","10.1016/j.paid.2014.09.023","How does mere social presence affect cognitive processes? The extant literature has focused on the impact of social presence on cognitive resources. The present study extends this work by focusing on the positivity of cognitive appraisal. Building on recent findings it was predicted that the traits neuroticism and impression management will differentially moderate the effect, such that neuroticism will be associated with a negative shift in appraisal, and impression management with a positive shift. In an experiment, participants (N=158) formed evaluations of life events either alone or in social presence. The results supported the predictions. The findings advance the knowledge about the effect of social presence on cognition, and about the role of personality in moderating responses in public social contexts.","Social facilitation, Social presence, Neuroticism, Impression management, Cognitive appraisal","",""
"Journal Article","Filevich E,Vanneste P,Brass M,Fias W,Haggard P,Kühn S","","Brain correlates of subjective freedom of choice","Consciousness and Cognition","2013","22","4","1271-1284","","","","2013","","1053-8100","https://www.sciencedirect.com/science/article/pii/S1053810013001244;http://dx.doi.org/10.1016/j.concog.2013.08.011","10.1016/j.concog.2013.08.011","The subjective feeling of free choice is an important feature of human experience. Experimental tasks have typically studied free choice by contrasting free and instructed selection of response alternatives. These tasks have been criticised, and it remains unclear how they relate to the subjective feeling of freely choosing. We replicated previous findings of the fMRI correlates of free choice, defined objectively. We introduced a novel task in which participants could experience and report a graded sense of free choice. BOLD responses for conditions subjectively experienced as free identified a postcentral area distinct from the areas typically considered to be involved in free action. Thus, the brain correlates of subjective feeling of free action were not directly related to any established brain correlates of objectively-defined free action. Our results call into question traditional assumptions about the relation between subjective experience of choosing and activity in the brain’s so-called voluntary motor areas.","Volition, Introspection, Free choice, fMRI","",""
"Journal Article","Englert C,Rummel J","","I want to keep on exercising but I don’t: The negative impact of momentary lacks of self-control on exercise adherence","Psychology of Sport and Exercise","2016","26","","24-31","","","","2016","","1469-0292","https://www.sciencedirect.com/science/article/pii/S1469029216300681;http://dx.doi.org/10.1016/j.psychsport.2016.06.001","10.1016/j.psychsport.2016.06.001","Objectives We investigated the impact of state and trait self-control strength on exercise execution. We hypothesized that state self-control strength is reduced on days that are perceived as stressful and that reductions in self-control strength result in a lower likelihood to work out. Additionally, trait self-control strength may affect the execution of workout plans. Design University students, who stated that they have not been exercising regularly for at least one month, filled in a trait self-control inventory, a personality questionnaire, and were instructed to perform a daily workout over a one-week period. Perceived stress levels, state self-control strength, and workout completion were assessed on a daily basis. Results Results revealed that people were less likely to exercise on days they perceived as stressful. State self-control mediated the relation between stress and exercise completion. Trait self-control and other personality variables did not affect workout completion. Conclusions Results indicate that daily stress is associated with self-control depletion and a lower likelihood to work out.","Ego depletion, Self-control, Self-regulation, Sport, Workout execution","",""
"Journal Article","Esturgó-Deu ME,Sala-Roca J","","Disruptive behaviour of students in primary education and emotional intelligence","Teaching and Teacher Education","2010","26","4","830-837","","","","2010","","0742-051X","https://www.sciencedirect.com/science/article/pii/S0742051X09002182;http://dx.doi.org/10.1016/j.tate.2009.10.020","10.1016/j.tate.2009.10.020","This study analyses the relation between disruptive behaviours and the emotional abilities of children in primary education. To do this, disruptive behaviour and emotional abilities were evaluated in 1422 pupils aged between 6 and 12 years of age at 11 education centres using EQIjv. No relation was found between disruptive behaviours and age, but one was found for sex and emotional abilities. Boys presented more disruptive behaviours than girls. However, there was a significant relation between disruptive behaviours and the general index of emotional intelligence. The most related abilities were stress management and interpersonal relations. Implications of these results are discussed.","Disruptive behaviour, Student adjustment, Emotional development, Emotional intelligence","",""
