"Item type","Authors","Editors","Title","Journal","Publication year","Volume","Issue","Pages","Publisher","Address","Book title","Date published","ISBN","ISSN","URLs","DOI","Abstract","Keywords","Notes","Series"
"Journal Article","Gino F,Schweitzer ME,Mead NL,Ariely D","","Unable to resist temptation: How self-control depletion promotes unethical behavior","Organizational Behavior and Human Decision Processes","2011","115","2","191-203","","","","2011","","0749-5978","https://www.sciencedirect.com/science/article/pii/S0749597811000422;http://dx.doi.org/10.1016/j.obhdp.2011.03.001","10.1016/j.obhdp.2011.03.001","Across four experimental studies, individuals who were depleted of their self-regulatory resources by an initial act of self-control were more likely to “impulsively cheat” than individuals whose self-regulatory resources were intact. Our results demonstrate that individuals depleted of self-control resources were more likely to behave dishonestly (Study 1). Depletion reduced people’s moral awareness when they faced the opportunity to cheat, which, in turn, was responsible for heightened cheating (Study 2). Individuals high in moral identity, however, did not show elevated levels of cheating when they were depleted (Study 3), supporting our hypothesis that self-control depletion increases cheating when it robs people of the executive resources necessary to identify an act as immoral or unethical. Our results also show that resisting unethical behavior both requires and depletes self-control resources (Study 4). Taken together, our findings help to explain how otherwise ethical individuals predictably engage in unethical behavior.","Impulsive cheating, Unethical behavior, Ego depletion, Dishonesty, Self-control, Self-regulatory resources, Moral identity, Ethical decision making","",""
"Journal Article","Fagan J,Ployhart RE","","The information processing foundations of human capital resources: Leveraging insights from information processing approaches to intelligence","Human Resource Management Review","2015","25","1","4-11","","","","2015","","1053-4822","https://www.sciencedirect.com/science/article/pii/S1053482214000485;http://dx.doi.org/10.1016/j.hrmr.2014.09.003","10.1016/j.hrmr.2014.09.003","This paper considers how information processing approaches to intelligence may offer implications for the study of human capital resources within organizations. We first provide a brief overview of human capital research that summarizes its evolution and current areas of emphasis. This review notes that most of the research on human capital has ignored key developments in the psychological study of intelligence. We then review contemporary approaches to studying intelligence as information processing. We conclude by proposing a broad agenda for integrating research on human capital resources with information processing approaches to intelligence.","Human capital resources, Intelligence, Information processing, Human resources","",""
"Journal Article","Finne E,Englert C,Jekauc D","","On the importance of self-control strength for regular physical activity","Psychology of Sport and Exercise","2019","43","","165-171","","","","2019","","1469-0292","https://www.sciencedirect.com/science/article/pii/S1469029218305545;http://dx.doi.org/10.1016/j.psychsport.2019.02.007","10.1016/j.psychsport.2019.02.007","Objectives Physical activity intentions do not automatically lead to physical activity behavior, indicating that there are other (psychological) factors involved. In the present study, we tested the assumption that self-control strength is required to bridge the intention-behavior gap in terms of initial and weekly intentions. Design A total of N = 259 individuals, who registered for a weekly university sports course, were followed for 13 weeks. Methods At baseline, trait self-control strength as well as the intention to take part in the respective sports course on a regular basis were measured. Then, we registered weekly participation and asked the participants after each training session to report their intention to show up at next week’s training session. Results Despite very high baseline as well as weekly exercise intentions, the participation rate dropped considerably over time, indicating a large intention-behavior gap. The association of within-person fluctuations in weekly intentions and actual participation was moderated by self-control: Only in individuals with high levels of trait self-control strength stronger intentions were associated with a higher chance of actual re-attendance. Baseline intention was also associated with participation but not moderated by self-control. Conclusions These findings indicate that high levels of self-control strength are beneficial in order to translate short-term intentions into actual behavior. Practical implications on how to improve self-control are discussed.","Intention-behavior gap, Physical activity, Self-control, Self-regulation, Sport","",""
"Journal Article","Yang Z,Wang J,Mourali M","","Effect of peer influence on unauthorized music downloading and sharing: The moderating role of self-construal","Journal of Business Research","2015","68","3","516-525","","","","2015","","0148-2963","https://www.sciencedirect.com/science/article/pii/S014829631400294X;http://dx.doi.org/10.1016/j.jbusres.2014.09.011","10.1016/j.jbusres.2014.09.011","This research develops an integrative model of music piracy, specifying self-control and differential association as antecedents, peer influence in music downloading/sharing as mediator, and self-construal as moderator. Disentangling peer influence into two forms—informational influence and normative influence—this research examines their differential effects on two aspects of music piracy: unauthorized downloading and unauthorized sharing. The findings suggest that informational influence is the key underlying mechanism through which self-control affects unauthorized downloading, whereas the two forms of peer influence mediate the relationship between differential association and both aspects of music piracy. Furthermore, the relationships among antecedents, mediator, and consequences (i.e., unauthorized downloading and unauthorized sharing) are contingent upon individuals' self-construal. These findings yield important implications and intervention programs (e.g., interpersonal skill training, educational extension programs, and artist-student contact points) that can curb music piracy.","Unauthorized sharing, Unauthorized downloading, Peer influence in music downloading/sharing, Self-control, Differential association, Self-construal","",""
"Journal Article","Shin SH,Hong HG,Jeon SM","","Personality and alcohol use: The role of impulsivity","Addictive Behaviors","2012","37","1","102-107","","","","2012","","0306-4603","https://www.sciencedirect.com/science/article/pii/S0306460311002917;http://dx.doi.org/10.1016/j.addbeh.2011.09.006","10.1016/j.addbeh.2011.09.006","Research has shown that personality traits associated with impulsivity influence alcohol use during emerging adulthood, yet relatively few studies have examined how distinct facets of impulsivity are associated with alcohol use and abuse. We examine the influence of impulsivity traits on four patterns of alcohol use including frequency of alcohol use, alcohol-related problems, binge drinking, and alcohol use disorders (AUDs) in a community sample of young individuals (N=190). In multivariate regression analyses that controlled for peer and parental alcohol use, psychological distress, and developmental correlates (i.e., college, marriage, employment) in emerging adulthood, we found that urgency and sensation seeking were consistently related to all four constructs of alcohol use. The present study suggests that distinct impulsivity traits may play different roles in escalation of alcohol use and development of AUDs during emerging adulthood.","Impulsivity, Alcohol use, Binge drinking, Alcohol-related problems, Alcohol use disorders, Urgency","",""
"Journal Article","Ode S,Robinson MD,Wilkowski BM","","Can one’s temper be cooled? A role for Agreeableness in moderating Neuroticism’s influence on anger and aggression","Journal of Research in Personality","2008","42","2","295-311","","","","2008","","0092-6566","https://www.sciencedirect.com/science/article/pii/S0092656607000694;http://dx.doi.org/10.1016/j.jrp.2007.05.007","10.1016/j.jrp.2007.05.007","The study followed from the idea that Neuroticism captures hot or facilitative vulnerabilities related to anger and aggression, whereas Agreeableness captures cool or inhibitory processes in relation to these same outcomes. As such, it was predicted that Neuroticism and Agreeableness should interact to predict anger and aggression according to hot/cool models of self-regulation. This hypothesis was systematically examined among three independent samples of participants (total N=176). As predicted, Neuroticism and Agreeableness interacted to predict anger and aggression among all samples, and did so in a manner consistent with the hypothesis that Neuroticism–anger relations would be lower at high levels of Agreeableness. The results therefore highlight the distinct roles of Neuroticism and Agreeableness in predicting anger and aggression, while placing these traits in a common interactive self-regulatory framework.","Neuroticism, Agreeableness, Anger, Aggression, Self-regulation","",""
"Journal Article","Cesar GT,Decker SH","","“CPS Sucks, but… I think I’m better off in the system:” Family, social support, & arts-based mentorship in child protective services","Children and Youth Services Review","2020","118","","105388","","","","2020","","0190-7409","https://www.sciencedirect.com/science/article/pii/S0190740920309774;http://dx.doi.org/10.1016/j.childyouth.2020.105388","10.1016/j.childyouth.2020.105388","In the United States, 400,000 children are in state custody through child protection systems (CPS), most commonly for parental neglect. While states focus on removing children from danger, familial separation leaves a social void with negative impacts that can extend into adulthood. To better understand how youth in state custody navigate that social void, we interviewed 33 youth (aged 13–17) who were in CPS custody about their relationships with family, perceptions of role models and mentorship, and experiences with an arts-based mentorship organization. We also discussed their projected futures after CPS custody. The interviews took place in the field, during a two-week Theatre Camp program. Theatre Campers’ narratives illustrate the paradox between state benevolence and youth development: many felt safer in CPS, but encountered barriers to connecting with formal and informal support. They missed family, but also used them as examples of what not to do. Their unique perspectives (in state custody, but not incarcerated) provide insight into how marginalized youth view and engage with various forms of social support. We explore the implications of these findings for research at the intersection of criminology and social work, holistic juvenile justice policy, and social support over the life-course.","Criminology, Juvenile justice, Child welfare, Social support, Mentorship, Art therapy","",""
"Journal Article","Berger S,Wyss AM,Knoch D","","Low self-control capacity is associated with immediate responses to smartphone signals","Computers in Human Behavior","2018","86","","45-51","","","","2018","","0747-5632","https://www.sciencedirect.com/science/article/pii/S074756321830195X;http://dx.doi.org/10.1016/j.chb.2018.04.031","10.1016/j.chb.2018.04.031","The ubiquitous use of smartphones has not only led to unprecedented levels of connectivity, but also raised the question about potentially problematic side effects such as phone-use while driving or phone-caused inattention in work or private settings. This poses the question about psychological mechanisms underlying this potentially self-damaging use. The present research addresses this question by showing how heterogeneity in people's self-control capacity explains behavioral differences in smartphone use. Specifically, we show that self-control capacity can be used to estimate whether a person immediately responds to a smartphone signal she receives. Thus, our research helps to identify personal characteristics that lead to a better understanding of problematic smartphone use and can potentially help to design appropriate protective mechanisms or interventions that target self-control capacity.","Smartphone use, Self-control, Self-regulation, Consumer, Psychology, Personality","",""
"Journal Article","Evans R,Norman P,Webb TL","","Using Temporal Self-Regulation Theory to understand healthy and unhealthy eating intentions and behaviour","Appetite","2017","116","","357-364","","","","2017","","0195-6663","https://www.sciencedirect.com/science/article/pii/S0195666316309072;http://dx.doi.org/10.1016/j.appet.2017.05.022","10.1016/j.appet.2017.05.022","Objectives The present research investigated whether Temporal Self-Regulation Theory (TST) can be used to help understand healthy and unhealthy eating intentions and behaviour. Design A prospective design with two waves of data collection one week apart. Method An online survey measured the key components of TST (i.e., connectedness, timing and valence beliefs, intentions, past behaviour, habit strength, perceived environmental cues, and self-control) with respect to eating fruit and vegetables (F&V; N = 133) or unhealthy snacks (N = 125). Eating behaviour was assessed one week later. Results The components of TST explained significant amounts of the variance in intentions and behaviour for intake of F&Vs (22% and 64%, respectively) and unhealthy snacks (18% and 35%, respectively). Beliefs about positive and negative short-term outcomes significantly predicted intentions to perform both behaviours. Intentions and past behaviour significantly predicted consumption of F&Vs, and past behaviour moderated the relationship between intention and behaviour which became stronger as past behaviour increased. Past behaviour and habit strength significantly predicted unhealthy snacking. Conclusions The findings suggest that TST may be a useful framework for understanding eating intentions and behaviour. However, research did not find support for all of the hypothesised relationships (e.g., self-regulatory capacity did not significantly predict eating behaviour and also failed to moderate the relationships between intentions and behaviour). Research using alternative measures of self-regulatory capacity, along with experimental manipulations of TST variables, may be needed to further understand eating intentions and behaviour.","Fruit and vegetable intake, Habits, Past behaviour, Self-control, Temporal Self-Regulation theory, Snacking","",""
"Journal Article","Hoskin AW,Meldrum RC","","The association between fetal testosterone and violent behavior: Additional evidence using the 2D:4D digit ratio","Personality and Individual Differences","2018","134","","293-297","","","","2018","","0191-8869","https://www.sciencedirect.com/science/article/pii/S0191886918303593;http://dx.doi.org/10.1016/j.paid.2018.06.027","10.1016/j.paid.2018.06.027","Recent meta-analyses on the relationship between prenatal testosterone—measured by the 2D:4D digit ratio—and aggression and analogous traits have reported an overall weak association. Fewer studies, however, have focused specifically on violent behavior. Yet, many of these studies have relied on small samples of incarcerated men and limited their focus to intimate partner violence. Less is known about whether the link between the 2D:4D ratio and violence holds for non-incarcerated populations, for females as well as males, and for general measures of violence. To address these issues, original data were collected on a sample of young adults to estimate the association between the 2D:4D ratio and self-reported violence. The study yielded two important findings. First, the 2D:4D ratio was associated with a majority of the individual violent behaviors examined, as well as multi-item measures of violence, in both bivariate and multivariate models. Second, the 2D:4D ratio was associated with violent behavior among separate samples of men and women, though associations were frequently non-statistically significant for females.","2D:4D, Prenatal testosterone, Violence, Aggression, Gender","",""
"Journal Article","Friedrich A,Jonkmann K,Nagengast B,Schmitz B,Trautwein U","","Teachers' and students' perceptions of self-regulated learning and math competence: Differentiation and agreement","Learning and Individual Differences","2013","27","","26-34","","","","2013","","1041-6080","https://www.sciencedirect.com/science/article/pii/S1041608013000800;http://dx.doi.org/10.1016/j.lindif.2013.06.005","10.1016/j.lindif.2013.06.005","Teachers' diagnostic competence is a crucial determinant of their teaching quality. However, prior research has indicated only a moderate association between teachers' and students' assessments of students' competence/self-concept and motivation. Furthermore, it is unclear how well teachers are able to differentiate between students' overall competence and other competence-relevant characteristics. The present article therefore investigated teachers' and students' perceptions of math competence/self-concept and two aspects of self-regulated learning (preactional and actional strategies), using a sample of 73 teachers and their fifth-grade students (N=1289). Exploratory structural equation modeling revealed three-factor solutions, indicating that both teachers and students differentiated between the assumed self-regulated learning factors and math competence/self-concept. Latent correlations between teachers' and students' perceptions were small to moderate; their assessments of students' math competence/self-concept showed the highest agreement. The findings are discussed with respect to their implications for assessing and improving teachers' diagnostic competence of students' learning.","Teacher assessment, Diagnostic competence, Self-regulated learning, Math competence, Self-concept","",""
"Journal Article","Seuntjens TG,Zeelenberg M,van de Ven N,Breugelmans SM","","Greedy bastards: Testing the relationship between wanting more and unethical behavior","Personality and Individual Differences","2019","138","","147-156","","","","2019","","0191-8869","https://www.sciencedirect.com/science/article/pii/S0191886918305130;http://dx.doi.org/10.1016/j.paid.2018.09.027","10.1016/j.paid.2018.09.027","Greed is often seen as immoral. Although the assumption that greed elicits unethical behavior is widespread, there is surprisingly little empirical research testing this relationship. We present a series of three studies investigating the association between greed and unethical behavior, using different methodologies and samples from the USA, The Netherlands, and Belgium. Study 1 (3 samples, total N = 3413) reveals that more greedy individuals find a variety of transgressions more acceptable and justifiable as well as indicate that they have more often engaged in a variety of transgressions compared to less greedy individuals. Study 2 (N = 172) replicated these findings in an incentivized behavioral laboratory study where participants decided to accept a bribe or not. Greedy people were more likely to take a bribe and also preferred higher bribes. Study 3 (N = 302) examined a potential process relating greed to unethical behavior. Greedy people were more likely to transgress because they found the positive outcomes associated with the transgression more desirable, and therefore displayed lower self-control. Implications for general theories of greed and morality are discussed.","Greed, Dispositional Greed Scale, Unethical behavior, Morality, Self-control","",""
"Journal Article","Assi GS","","Dangerous driving propensity amongst Indian youth","Transportation Research Part F: Traffic Psychology and Behaviour","2018","56","","444-452","","","","2018","","1369-8478","https://www.sciencedirect.com/science/article/pii/S1369847817301055;http://dx.doi.org/10.1016/j.trf.2018.05.016","10.1016/j.trf.2018.05.016","The aim of the present investigation was to study the role of sensation-seeking and impulsiveness in propensity towards dangerous driving. For this purpose, a sample of four hundred young drivers between the age group of 18–23 years was assessed on measures of sensation-seeking, impulsiveness and dangerous driving. The sample was further classified into male and female drivers. The constructs of sensation-seeking and impulsiveness were studied through their components or sub-scales. Therefore, sensation-seeking was assessed with its sub-scales of boredom susceptibility, experience seeking, disinhibition and thrill and adventure seeking while impulsiveness was gauged through attentional, motor and non-planning impulsiveness. The statistical analysis of correlation was performed to assess relationships amongst variables with stepwise multiple regression analysis for prediction of dangerous driving. The results of present investigation revealed positive correlations between all the variables assessed on the overall sample and amongst the groups of male and female drivers. Through regression analysis on the overall sample, disinhibition emerged to be the major predictor showing maximum variance followed by motor impulsiveness, attentional impulsiveness, non-planning impulsiveness and thrill and adventure seeking. Amongst male drivers, motor impulsiveness showed maximum variance for dangerous driving followed by disinhibition, attentional impulsiveness and non-planning impulsiveness. However, amongst female drivers, disinhibition was found to be the major predictor for dangerous driving having maximum variance followed by motor impulsiveness and attentional impulsiveness. The study gives a psychological insight into the dangerous driving behaviour of young drivers. These issues are therefore of grave concern especially for the drivers in India with its increasing young population, growing number of vehicles on roads, incidence of road rage, fatalities and like.","Dangerous driving, Sensation-seeking, Impulsiveness, India, Youth","",""
"Journal Article","Galla BM,Plummer BD,White RE,Meketon D,D'Mello SK,Duckworth AL","","The Academic Diligence Task (ADT): assessing individual differences in effort on tedious but important schoolwork","Contemporary Educational Psychology","2014","39","4","314-325","","","","2014","","0361-476X","https://www.sciencedirect.com/science/article/pii/S0361476X14000502;http://dx.doi.org/10.1016/j.cedpsych.2014.08.001","10.1016/j.cedpsych.2014.08.001","The current study reports on the development and validation of the Academic Diligence Task (ADT), designed to assess the tendency to expend effort on academic tasks which are tedious in the moment but valued in the long-term. In this novel online task, students allocate their time between solving simple math problems (framed as beneficial for problem solving skills) and, alternatively, playing Tetris or watching entertaining videos. Using a large sample of high school seniors (N = 921), the ADT demonstrated convergent validity with self-report ratings of Big Five conscientiousness and its facets, self-control and grit, as well as discriminant validity from theoretically unrelated constructs, such as Big Five extraversion, openness, and emotional stability, test anxiety, life satisfaction, and positive and negative affect. The ADT also demonstrated incremental predictive validity for objectively measured GPA, standardized math and reading achievement test scores, high school graduation, and college enrollment, over and beyond demographics and intelligence. Collectively, findings suggest the feasibility of online behavioral measures to assess noncognitive individual differences that predict academic outcomes.","Academic diligence, Self-control, Grit, Assessment, Academic performance, Validation","",""
"Journal Article","Groß D","","In the self-control and self-regulation maze: Integration and importance","Personality and Individual Differences","2021","175","","110728","","","","2021","","0191-8869","https://www.sciencedirect.com/science/article/pii/S0191886921001033;http://dx.doi.org/10.1016/j.paid.2021.110728","10.1016/j.paid.2021.110728","Self-control and self-regulation can be seen as core aspects of adaptive human behavior, which are studied, largely in parallel, in the field of social, health, personality, cognitive, and developmental psychology. This review tries to firstly bring and review the different research directions together and shows the importance of self-control and self-regulation for present and future success in life by focusing on the marshmallow experiment, different self-control and self-regulation measurements like trait and state self-control, executive functions, heart rate variability, personality, and theories which combine control capacity and control motivation to predict self-control. Moreover, also the associations between different self-control and self-regulation variables are in the focus of this review.","Self-regulation, Self-control, Executive functions, Heart rate variability, Personality","",""
