"Item type","Authors","Editors","Title","Journal","Publication year","Volume","Issue","Pages","Publisher","Address","Book title","Date published","ISBN","ISSN","URLs","DOI","Abstract","Keywords","Notes","Series"
"Journal Article","Beaton AM,Dovidio JF,LeBlanc J","","Traditional prejudice and justice judgments: Does bias suppression moderate the relationship?","Personality and Individual Differences","2011","51","5","579-583","","","","2011","","0191-8869","https://www.sciencedirect.com/science/article/pii/S0191886911002522;http://dx.doi.org/10.1016/j.paid.2011.05.022","10.1016/j.paid.2011.05.022","This research investigated how the relationship between prejudice and intergroup inequalities with justice judgments is modulated by individual differences in self-regulation of bias through suppression. The first study conducted among 170 White British adolescents revealed that the link between racism and intergroup inequality in justice judgments was moderated by bias suppression. Prejudice, bias suppression, and blatant as well as subtle justice judgments were assessed in a second study carried out with 103 Canadian White adolescents. Bias suppression moderated the link between racist beliefs toward Aboriginals and intergroup inequality in punitive rulings. Racism translated into intergroup inequality in the potential for rehabilitation, irrespective of the level of bias suppression. The role of bias suppression is discussed.","Prejudice, Justice, Bias suppression","",""
"Journal Article","Fonteyne L,Duyck W,De Fruyt F","","Program-specific prediction of academic achievement on the basis of cognitive and non-cognitive factors","Learning and Individual Differences","2017","56","","34-48","","","","2017","","1041-6080","https://www.sciencedirect.com/science/article/pii/S1041608017300997;http://dx.doi.org/10.1016/j.lindif.2017.05.003","10.1016/j.lindif.2017.05.003","Choosing a suitable study program is one of the factors that facilitates academic achievement and thus prevents drop-out in the first year of tertiary education. This requires adequate information on both the individual abilities and the environment during the study choice process. The SIMON (Study Skills and Interest MONitor) project of Ghent University, Belgium, provides this information to prospective students through an online tool that informs them a) on the match between their interests and study programs and b) about their personal chances of success in specific study programs. The current study intends to validate the prediction of program-specific chances of success by examining a) the (incremental) predictive validity of cognitive and non-cognitive variables of conscientiousness, motivation, self-efficacy, metacognition and test anxiety and b) the differential predictive power of variables within and across study programs. In addition, a path model with structural relations between variables was tested. The sample consisted of 2391 new incoming students. Results supported the incremental validity of non-cognitive factors. Achievement could be predicted by cognitive and background factors and by conscientiousness, self-efficacy and test anxiety. Moreover, the predictive power of variables varied across study programs, which suggests that research findings about the prediction of academic achievement might benefit from taking into account the specific program context. Practical implications for research and (educational program choice) counselling of students are discussed.","Educational program choice, Differential predictive validity, Program specific prediction, Higher education academic achievement, Non-cognitive assessment","",""
"Journal Article","Oi K","","Does degree completion improve non-cognitive skills during early adulthood and adulthood?","Journal of Adolescence","2019","71","","50-62","","","","2019","","0140-1971","https://www.sciencedirect.com/science/article/pii/S0140197118302082;http://dx.doi.org/10.1016/j.adolescence.2018.12.001","10.1016/j.adolescence.2018.12.001","Introduction Non-cognitive skills, particularly in terms of risk-aversion, future-orientation, and conscientiousness, grow with age, and this phenomenon is known as personality maturation. However, significant variability in maturation among individuals exists. The technology of cognitive/non-cognitive skill formation suggests that the growth of non-cognitive skills is contingent on cognitive skills or human capital in general. The completion of formal education is a quintessential form of human capital. The aim of this study is to test whether formal education indeed facilitates the improvement of non-cognitive skills during early adulthood and adulthood.] Methods I used data from the National Longitudinal Study of Adolescent to Adult Health. The study sample consists of 9291 individuals, representative of U.S. adolescents in grades 7 through 12 in 1994. The longitudinal design of the data allowed the repeated measurement of their non-cognitive skills in adolescence (age 25). I used Latent Score Difference modeling to examine whether advancement in formal education through degree completion predicts within-individual change in non-cognitive skills in early adulthood and adulthood. Results A steady increase in non-cognitive skills beyond adolescence was found. Independently of academic engagement during high school, parental socio-economic status, and adolescent non-cognitive skills, degree completion reported in early adulthood coincides with gains in non-cognitive skills since adolescence, and this positive feedback repeats itself in adulthood. Conclusions Continued schooling facilitates personality maturation beyond adolescence. Given the profound effects of non-cognitive skills on various life outcomes, educational opportunities could alleviate social stratification.","Education, Personality, Adolescence, Life course, Longitudinal analysis","",""
"Journal Article","Samuel RD,Englert C,Zhang Q,Basevitch I","","Hi ref, are you in control? Self-control, ego-depletion, and performance in soccer referees","Psychology of Sport and Exercise","2018","38","","167-175","","","","2018","","1469-0292","https://www.sciencedirect.com/science/article/pii/S1469029217307355;http://dx.doi.org/10.1016/j.psychsport.2018.06.009","10.1016/j.psychsport.2018.06.009","Objectives Soccer referees are challenged by physiological, professional, and mental demands which require them to exercise self-control for optimal performance. We applied the strength model of self-control (e.g., Baumeister & Vohs, 2016; Baumeister et al., 1998) to examine the relationship between self-control strength and performance in real matches. Design and methods Sixteen soccer referees (M age = 30.06 yrs, SD = 7.38) completed a trait self-control scale. Then, over 2–4 matches they completed measures of daily hassles prior to the match and state self-control prior to and after the match. Personal, situational and performance indices were also collected. Data were analyzed using several statistical procedures, including hierarchical linear modeling. Results The referees exhibited higher levels of trait self-control compared with professional soccer players and the general population. Their state self-control scores were also high. A noticeable decrease (10% or more) in state self-control strength (i.e., ego depletion) was evident in almost half of the matches. Experience of daily hassles and travel time to the match were related to lower pre-match self-control. Ego depletion was associated with self-reported match difficulty and was negatively related to self-rated match performance. Conclusions The findings are in line with previous studies and the strength model of self-control, highlighting the importance of self-control strength in soccer refereeing. Practitioners and Referee Unions should support referees in planning match day routines to maintain self-control strength.","State self-control, Trait self-control, Daily hassles, Officials, Football","",""
"Journal Article","Liu QQ,Zhou ZK,Yang XJ,Kong FC,Sun XJ,Fan CY","","Mindfulness and sleep quality in adolescents: Analysis of rumination as a mediator and self-control as a moderator","Personality and Individual Differences","2018","122","","171-176","","","","2018","","0191-8869","https://www.sciencedirect.com/science/article/pii/S0191886917306372;http://dx.doi.org/10.1016/j.paid.2017.10.031","10.1016/j.paid.2017.10.031","Previous studies have documented that mindfulness was positively correlated with favorable sleep quality, however, the underlying mechanisms are largely unknown. The present study examined the mediating role of rumination and the moderating role of self-control in the association between mindfulness and sleep quality. A sample of 1196 adolescents completed a battery of self-report questionnaires measuring mindfulness, rumination, self-control and sleep quality as well as demographic information. Results showed that, in addition to the negative link between mindfulness and poor sleep quality, mindfulness was negatively associated with rumination, which in turn was positively associated with poor sleep quality. The direct link between mindfulness and poor sleep quality and the indirect link through rumination were both moderated by self-control. These two effects were stronger for adolescents with low self-control than for those with high self-control. These results coincide with the antagonistic interaction hypothesis of the protective-protective model, and indicate that mindfulness and self-control, as two important protective factors of adolescents, may mutually compensate. Limitations and implications are discussed.","Mindfulness, Sleep quality, Rumination, Self-control, Adolescents","",""
"Journal Article","Alexandra V","","The role of social worldviews and self-control in moral disengagement","Personality and Individual Differences","2019","143","","74-79","","","","2019","","0191-8869","https://www.sciencedirect.com/science/article/pii/S0191886919300868;http://dx.doi.org/10.1016/j.paid.2019.02.012","10.1016/j.paid.2019.02.012","Drawing from social cognitive theory and research on social worldviews and self-control, this study examines the relationships between five universally endorsed social worldviews and moral disengagement, and the role of self-control trait as a moderator in these relationships. Using data collected from 204 business professionals, this study found that social cynicism and fate control worldviews were positively related to moral disengagement, while social complexity and reward for application worldviews were negatively related to moral disengagement. Furthermore, the effects of social cynicism, fate control, and social complexity worldviews on moral disengagement were stronger for individuals lower on self-control trait and not significant for individuals higher on self-control trait. Implications for research and practice are discussed.","Social worldviews, Moral disengagement, Self-control","",""
"Journal Article","Mathes EW,Lane DJ,Helmers BR,Jamnik MR,Hendrickson M,Aleshire B","","The dark side of self-control: High self-control leads to better outcomes when engaging in bad behaviors","Personality and Individual Differences","2017","105","","326-329","","","","2017","","0191-8869","https://www.sciencedirect.com/science/article/pii/S0191886916310339;http://dx.doi.org/10.1016/j.paid.2016.10.005","10.1016/j.paid.2016.10.005","","Self-control, Antisocial behavior, Punishment evasion","",""
"Journal Article","Chang YC,Chang YT,Chang HY,Feng JY","","Effects of academic performance on the relationship between child maltreatment and deviant behavior: A national study in Taiwan","Child Abuse & Neglect","2019","98","","104224","","","","2019","","0145-2134","https://www.sciencedirect.com/science/article/pii/S0145213419304016;http://dx.doi.org/10.1016/j.chiabu.2019.104224","10.1016/j.chiabu.2019.104224","Background Child maltreatment has been found to significantly increase the risk of deviant behavior. Academic performance has been shown to have an indirect effect on the relationship between child maltreatment and deviant behavior. However, not all adolescents who have been maltreated engage in deviant behavior, so the relationship between child maltreatment and deviant behavior has remained unclear. Objective The aim of this research was to examine the potential mediating and/or moderating effects of academic performance on the relationship between child maltreatment and deviant behavior. Participants and setting The data in this study were from a nationwide study examining the consequences of childhood maltreatment in Taiwan. The database consisted of data from 2321 adolescents. Methods A secondary data analysis was conducted. Self-report data were obtained on childhood maltreatment experiences, academic performance, and deviant behaviors. Path analyses and a generalized linear model were used to examine the effects of academic performance on the relationship between child maltreatment and deviant behavior. Results Most participants were male (61.4%), with a mean age of 15.9 years. The mean scores of self-rated academic performance and deviant behavior were 2.86 and 8.2, respectively. A total of 83% participants reported having experienced childhood maltreatment. In this study, academic performance was found to have a moderating rather than a mediating effect on the relationship between child maltreatment and deviant behavior. Among adolescents who had been maltreated during childhood, those who self-rated poorer academic performance were more likely to have a higher deviant behavior score than those who self-rated better academic performance. Conclusions Good academic performance can be a buffer that reduces the risk of deviant behavior among individuals with a history of childhood maltreatment. Healthcare professionals and educators can tailor early prevention and intervention educational programs targeted toward adolescents with experience of childhood abuse or poor academic performance to prevent the incidence of deviant behavior and thus break the cycle of violence.","Academic performance, Child maltreatment, Deviant behavior","",""
"Journal Article","Resch HL,Lord CG","","Individual differences in using epistemic and teleologic strategies for deliberate self-persuasion","Personality and Individual Differences","2011","50","5","615-620","","","","2011","","0191-8869","https://www.sciencedirect.com/science/article/pii/S0191886910005891;http://dx.doi.org/10.1016/j.paid.2010.12.005","10.1016/j.paid.2010.12.005","Some theorists have suggested that people can change their own attitudes simply by thinking differently about the attitude object. Maio and Thomas (2007) identified two distinct types of cognitive strategies for such deliberate self-persuasion. Epistemic strategies involve re-conceptualizing the attitude object’s known shortcomings in a more positive light. Teleologic strategies involve altering the accessibility of thoughts about those shortcomings. The present research showed that people can be taught to use these strategies effectively, but that the benefits are moderated by individual differences. Both epistemic and teleologic strategies are more effective for individuals high than low in need for cognition, and teleologic strategies are less effective than epistemic strategies for individuals low than high in self-control. The results show how Maio and Thomas’ (2007) strategies might be applied to important current attitudes, and extend knowledge of two important individual difference constructs.","Attitude change, Self-persuasion, Need for cognition, Self-control","",""
"Journal Article","Keatley DA,Allom V,Mullan B","","The effects of implicit and explicit self-control on self-reported aggression","Personality and Individual Differences","2017","107","","154-158","","","","2017","","0191-8869","https://www.sciencedirect.com/science/article/pii/S0191886916311461;http://dx.doi.org/10.1016/j.paid.2016.11.046","10.1016/j.paid.2016.11.046","Aggression and violence have a large impact on society. Researchers have highlighted the need to incorporate impulsive processes into models of aggression. The current research is the first to investigate the role of self-control, measured by both explicit questionnaires and an implicit association test, on trait aggression. Results indicated that higher levels of implicit self-control were associated with lower levels of anger, and physical and verbal aggression, but not hostility while higher levels of explicit self-control were related to lower levels of all types of aggression. We also investigated the role of gender in the current study and showed that gender was associated with aggressive tendencies, such that males had higher levels of trait aggression on three out of four outcomes, and the relationship between explicit self-control and physical aggression differed according to gender whereby the relationship between these variables was stronger among males. The current findings provide the first indication that both implicit and explicit self-control have roles in aggressive tendencies.","Implicit, IAT, Aggression, Self-control, Dual-process","",""
"Journal Article","Jahng KE","","Maternal abusive parenting and young South Korean adolescents' problematic smartphone use: The moderating effects of time spent hanging out with peers and trusting peer relationships","Children and Youth Services Review","2019","98","","96-104","","","","2019","","0190-7409","https://www.sciencedirect.com/science/article/pii/S0190740918308648;http://dx.doi.org/10.1016/j.childyouth.2018.12.028","10.1016/j.childyouth.2018.12.028","Introduction Young adolescents with abusive mothers act abusively are at high risk of developing problematic smartphone use as a means of avoiding an unsatisfying reality and making connections with others via a smartphone (Kwak, Kim, & Yoon, 2018). This study is based on the following hypotheses: Mothers' abusive parenting predicts young adolescents' problematic smartphone use; and the relationship between mothers' abusive parenting and young adolescents' problematic smartphone use is moderated by trusting peer relationships and/or the amount of time spent hanging out with peers. Methods Participants consisted of 506 middle school students aged between 13 and 15 years in South Korea. Results & conclusions Using multiple hierarchical regression, the results reveal the effect of mothers' abusive parenting on adolescents' problematic smartphone use, and the moderating effect of the amount of time spent hanging out with peers on the relationship between abusive parenting and problematic smartphone use. Adolescents' perceived trusting peer relationships did not moderate the relationship between the two variables. These results indicate that forming at least a minimum quantity of peer relationship contributes to fulfilling the need to belong, thereby buffering the impact of mothers' abusive parenting on adolescents' problematic smartphone use.","Early adolescence, Problematic smartphone use, mothers' abusive parenting, Time spent hanging out with peers, Trusting peer relationships","",""
"Journal Article","Allom V,Mullan B","","Individual differences in executive function predict distinct eating behaviours","Appetite","2014","80","","123-130","","","","2014","","0195-6663","https://www.sciencedirect.com/science/article/pii/S0195666314002098;http://dx.doi.org/10.1016/j.appet.2014.05.007","10.1016/j.appet.2014.05.007","Executive function has been shown to influence the performance of health behaviours. Healthy eating involves both the inhibitory behaviour of consuming low amounts of saturated fat, and the initiatory behaviour of consuming fruit and vegetables. Based on this distinction, it was hypothesised that these behaviours would have different determinants. Measures of inhibitory control and updating were administered to 115 participants across 2 days. One week later saturated fat intake and fruit and vegetable consumption were measured. Regression analyses revealed a double dissociation effect between the different executive function variables and the prediction of eating behaviours. Specifically, inhibitory control, but not updating, predict saturated fat intake, whilst updating, but not inhibitory control, was related to fruit and vegetable consumption. In both cases, better executive function capacity was associated with healthier eating behaviour. The results support the idea that behaviours that require stopping a response such as limiting saturated fat intake, have different determinants to those that require the initiation of a response such as fruit and vegetable consumption. The findings suggest that interventions aimed at improving these behaviours should address the relevant facet of executive function.","Executive function, Inhibitory control, Working memory, Updating, Healthy eating","",""
"Journal Article","Özdemir Y,Kuzucu Y,Ak Ş","","Depression, loneliness and Internet addiction: How important is low self-control?","Computers in Human Behavior","2014","34","","284-290","","","","2014","","0747-5632","https://www.sciencedirect.com/science/article/pii/S0747563214000697;http://dx.doi.org/10.1016/j.chb.2014.02.009","10.1016/j.chb.2014.02.009","This study aimed to explore both the direct and indirect relationships between depression, loneliness, low self-control, and Internet addiction in a sample of Turkish youth, based on a cognitive-behavioral model of generalized problematic Internet use. Data for the present study were collected from 648 undergraduate students with a mean age of 22.46years (SD=2.45). Participants completed scales for depression, loneliness, self-control and Internet addiction. Structural equation modeling was used to test the model in which depression and loneliness predicted Internet addiction through low self-control. The findings revealed that of the two factors, only loneliness was related to Internet addiction through low self-control. The results are discussed in terms of the cognitive-behavioral model of generalized problematic Internet use, and implications for practice are considered.","Depression, Loneliness, Internet addiction, Self-control","",""
"Journal Article","Denson TF,Wilkowski BM,DeWall CN,Friese M,Hofmann W,Ferguson EL,Capper MM,Kasumovic MM","","“Thou Shalt Kill”: Practicing self-control supports adherence to personal values when asked to aggress","Journal of Experimental Social Psychology","2017","69","","71-78","","","","2017","","0022-1031","https://www.sciencedirect.com/science/article/pii/S0022103116300294;http://dx.doi.org/10.1016/j.jesp.2016.09.001","10.1016/j.jesp.2016.09.001","Poor self-control is a root cause of aggression and criminality. But people can improve their self-control through repetitive practice. Because self-control involves acting in accordance with personal values, practicing self-control can promote attainment of value-consistent goals. The present research tested the hypothesis that practicing self-control could both decrease and increase obedient aggression. In Experiment 1, relative to the active control group, participants who practiced self-control were more hesitant to engage in mock violence (e.g., “cutting” the experimenter's throat with a rubber knife), especially for participants high in dispositional empathy. In Experiment 2, practicing self-control increased obedience to kill insects, but only among participants who felt little moral responsibility for their actions. There was a trend for decreased killing among participants who felt morally responsible for their actions. Our findings suggest that when asked to behave aggressively, self-control promotes adherence to personal values, which may or may not fuel aggression.","Self-control training, Aggression, Bug killing, Empathy, Moral responsibility","",""
"Journal Article","Robinson MD,Persich MR,Irvin RL","","An ego effectiveness perspective of successful self-control: An individual difference and its links to social functioning and well-being","Journal of Research in Personality","2022","97","","104207","","","","2022","","0092-6566","https://www.sciencedirect.com/science/article/pii/S0092656622000204;http://dx.doi.org/10.1016/j.jrp.2022.104207","10.1016/j.jrp.2022.104207","Recent theorizing has emphasized the need to develop new models of successful self-control. Using materials that describe friendship-related challenges, potential ways of responding to them, and distinct frames targeting the acting self as well as more abstract ideas concerning effectiveness, three studies (total N = 542) quantified friendship-related ego effectiveness as a within-subject correlation between self-likelihood ratings and effectiveness ratings. Ego effective individuals reported higher levels of self-control (Study 1), were deemed to be more socially competent by peers (Study 2), and experienced higher levels of well-being in their daily lives (Study 3). The results highlight a form of alignment within the self-system that can be leveraged to understand variations in social behavior as well as social and emotional functioning.","Ego, Self-regulation, Situational judgment, Social behavior, Well-being","",""
